Company,timestamp,headline
TXN,2020-08-25 01:24:00,"Top Stock Reports for JNJ, Procter & Gamble & Thermo Fisher Zacks"
TXN,2020-08-25 09:15:00,Top Ranked Income Stocks to Buy for August 25th Zacks
TXN,2020-08-24 11:30:00,Is Texas Instruments (TXN) Outperforming Other Computer and Technology Stocks This Year? Zacks
TXN,2020-08-22 09:27:00,Barrons Stock Pick: Synaptics Makeover Could Lead to Dramatic Growth Barrons.com
TXN,2020-08-21 10:24:00,Top Ranked Income Stocks to Buy for August 21st Zacks
TXN,2020-08-21 09:15:00,Better Buy: NVIDIA vs. Texas Instruments Motley Fool
TXN,2020-08-20 11:30:00,Why Is Texas Instruments (TXN) Up 4.5% Since Last Earnings Report? Zacks
TXN,2020-08-20 10:24:00,"The Zacks Analyst Blog Highlights: Maxim Integrated Products, Analog Devices, Texas Instruments and NVIDIA Zacks"
TXN,2020-08-20 10:04:00,"Zacks Earnings Trends Highlights: Texas Instruments, Advanced Micro Devices, Whirlpool and Cognizant Zacks"
TXN,2020-08-19 09:33:00,"Got $3,000 to Invest? These 3 IoT Stocks Could Make You a Fortune Motley Fool"
TXN,2020-08-19 12:01:00,Understanding Texas Instruments's Unusual Options Activity Benzinga
TXN,2020-08-19 09:42:00,Semiconductor-General Stock Outlook: Moderately Positive Prospects Zacks
TXN,2020-08-19 07:04:00,Red-Hot NVIDIA & Other Chip Bigwigs to Add to Your Portfolio Zacks
TXN,2020-08-18 04:01:00,Haviv Ilan named chief operating officer of TI PR Newswire
TXN,2020-08-14 10:41:00,"Grocery Outlet, Wix.com, Texas Instruments, Etsy and Teradyne highlighted as Zacks Bull and Bear of the Day Zacks"
TXN,2020-08-13 04:03:00,3 Growth Stocks with the Highest Zacks Rank Zacks
TXN,2020-08-13 12:21:00,"Zacks Earnings Trends Highlights: Texas Instruments, AMD, Whirlpool and Cognizant Zacks"
TXN,2020-08-10 07:00:00,"A Big Fund Manager Sold Berkshire, Verizon and GE Stock. It Bought This Chip Stock. Barrons.com"
TXN,2020-08-07 11:30:00,Has Texas Instruments (TXN) Outpaced Other Computer and Technology Stocks This Year? Zacks
TXN,2020-08-06 11:10:00,Semiconductor ETFs Roaring to New Highs on Solid Earnings Zacks
TXN,2020-08-06 08:45:00,"Zacks Earnings Trends Highlights: Texas Instruments, Advanced Micro Devices, Whirlpool and Cognizant Zacks"
TXN,2020-08-05 03:00:00,Texas Instruments Rises Amid Coronavirus Market Recovery; Can It Sustain The Gain? Investor's Business Daily
TXN,2020-08-03 11:22:00,"The Zacks Analyst Blog Highlights: Shopify, T-Mobile US, Texas Instruments, Asure and Calix Zacks"
TXN,2020-08-02 06:53:00,10 US Companies With Highest Revenue Exposure To China Insider Monkey
TXN,2020-08-02 05:30:00,3 Stocks for a Better Retirement Motley Fool
TXN,2020-07-31 08:00:00,Trane Stock: a Very Cool Pick Barrons.com
TXN,2020-07-30 11:52:00,10 Biggest Semiconductor Companies Investopedia
TXN,2020-07-30 11:17:00,"Zacks Earnings Trends Highlights: Texas Instruments, JPMorgan, Whirlpool and Goldman Sachs Zacks"
TXN,2020-07-28 08:43:00,"The Zacks Analyst Blog Highlights: Facebook, Alphabet, Texas Instruments, Dollar General and Kroger Zacks"
TXN,2020-07-27 02:15:00,"SWKS, STM or TXN: Which Looks Best Post-Earnings? Zacks"
TXN,2020-07-27 11:30:00,Why Texas Instruments Is a Great Dividend Stock Motley Fool
TXN,2020-07-27 10:45:00,Tech Analyst Says Valuations Hit a Wall Following Recent Gains Bloomberg
TXN,2020-07-26 10:00:00,Only Three Days Left To Cash In On Texas Instruments' (NASDAQ:TXN) Dividend Simply Wall St.
TXN,2020-07-23 10:42:00,"Zacks Earnings Trends Highlights: Texas Instruments, JPMorgan, Whirlpool and Goldman Sachs Zacks"
TXN,2020-07-23 07:10:00,Like Dividends? I Bet You'll Love These 3 Stocks. Motley Fool
TXN,2020-07-23 04:51:00,"STMicro Raises 3Q, FY Guidance on Improved Market Conditions Bloomberg"
TXN,2020-07-22 02:37:00,Let's Try to Graph Out Texas Instruments' Correction TheStreet.com
TXN,2020-07-22 01:54:00,"AMD, IBM, Texas Instruments: Tech Stock Midday Movers TheStreet.com"
TXN,2020-07-22 11:30:00,Is Texas Instruments (TXN) Stock Outpacing Its Computer and Technology Peers This Year? Zacks
TXN,2020-07-22 10:33:00,China will be pulled back to top of investor concerns after earnings season: Strategist Yahoo Finance Video
TXN,2020-07-22 10:05:00,"Texas Instruments (TXN) Q2 Earnings Beat, Revenues Down Y/Y Zacks"
TXN,2020-07-22 09:56:00,"Dow Jones Today, Stocks Turn Higher: Tesla, Microsoft Rise Ahead Of Earnings; Pfizer Spikes On HHS Vaccine Deal Investor's Business Daily"
TXN,2020-07-22 09:43:00,"Taiwan Semiconductor Manufacturing Company, Boot Barn, Snap, Texas Instruments and TD Ameritrade highlighted as Zacks Bull and Bear of the Day Zacks"
TXN,2020-07-22 09:35:00,"Benzinga's Top Upgrades, Downgrades For July 22, 2020 Benzinga"
TXN,2020-07-22 09:07:00,Is There Now An Opportunity In Texas Instruments Incorporated (NASDAQ:TXN)? Simply Wall St.
TXN,2020-07-22 08:55:00,Texas Instruments' Debt Overview Benzinga
TXN,2020-07-22 08:14:00,Dow Jones Futures Fall 100 Points On U.S.-China Tensions; Pfizer Soars 5% On Coronavirus Vaccine Deal Investor's Business Daily
TXN,2020-07-22 03:47:00,Texas Instruments Provides Upbeat Sales Outlook; Top Analyst Sees 18% Upside SmarterAnalyst
TXN,2020-07-21 09:00:00,Texas Instruments Inc (TXN) Q2 2020 Earnings Call Transcript Motley Fool
TXN,2020-07-21 08:24:00,[video]6 Key Takeaways from Texas Instruments' Earnings Report and Call TheStreet.com
TXN,2020-07-21 07:13:00,Texas Instruments Gives Strong Forecast But Urges Caution Bloomberg
TXN,2020-07-21 05:44:00,Texas Instruments Q2 Earnings Beat Forecasts TheStreet.com
TXN,2020-07-21 05:25:00,Texas Instruments (TXN) Q2 Earnings and Revenues Surpass Estimates Zacks
TXN,2020-07-21 05:08:00,"Chipmaker Texas Instruments Tops Second-Quarter Targets, Guides Higher Investor's Business Daily"
TXN,2020-07-21 05:05:00,Recap: Texas Instruments Q2 Earnings Benzinga
TXN,2020-07-21 04:49:00,Texas Instruments Stock Is Rising Because Earnings Crushed Expectations Barrons.com
TXN,2020-07-21 04:12:00,"Texas Instruments stock rises on earnings, outlook beat MarketWatch"
TXN,2020-07-21 04:01:00,TI reports second quarter 2020 financial results and shareholder returns PR Newswire
TXN,2020-07-21 01:50:00,A Look Into Texas Instruments' Debt Benzinga
TXN,2020-07-21 08:57:00,"The Zacks Analyst Blog Highlights: Texas Instruments, Teradyne, Intel, MaxLinear and NXP Semiconductors Zacks"
TXN,2020-07-21 06:05:00,Big Earnings Week for Chip Bellwethers: 2 Solid Buys Zacks
TXN,2020-07-20 08:52:00,Can Texas Instruments Sustain Its Earnings Beat Trend in Q2? Zacks
TXN,2020-07-20 08:50:00,Is a Surprise Coming for Texas Instruments (TXN) This Earnings Season? Zacks
TXN,2020-07-17 09:28:00,What's in Store for Texas Instruments' (TXN) Q2 Earnings? Zacks
TXN,2020-07-16 05:01:00,"Intel, Texas Instruments To Kickstart Chip Earnings With 'Better-Than-Feared' Results Benzinga"
TXN,2020-07-16 04:10:00,Texas Instruments board declares third quarter 2020 quarterly dividend PR Newswire
TXN,2020-07-15 12:10:00,Can Texas Instruments (TXN) Keep the Earnings Surprise Streak Alive? Zacks
TXN,2020-07-14 12:30:00,Earnings Preview: Texas Instruments (TXN) Q2 Earnings Expected to Decline Zacks
TXN,2020-07-13 12:38:00,Analog Devices to Buy Rival Maxim in $21 Billion Chip Deal Bloomberg
TXN,2020-07-13 10:14:00,A $21 Billion Chip Deal Messes With Texas Instruments Bloomberg
TXN,2020-07-13 02:43:00,"Top 5 Things to Know in the Market on Monday, July 13th Investing.com"
TXN,2020-07-12 09:23:00,Analog Devices Near Deal to Buy Maxim for $17 Billion Bloomberg
TXN,2020-07-07 09:00:00,TI introduces the industry's first zero-drift Hall-effect current sensors PR Newswire
TXN,2020-07-06 08:38:00,Were Hedge Funds Right About Texas Instruments Incorporated (TXN)? Insider Monkey
TXN,2020-07-06 06:00:00,"US Indexes Close Higher Monday, Following China Rally GuruFocus.com"
TXN,2020-07-01 12:25:00,Texas Instruments to webcast Q2 2020 earnings conference call PR Newswire
TXN,2020-07-01 07:15:00,Love Dividends? 3 Stocks You Might Want to Buy Motley Fool
TXN,2020-06-30 06:37:00,Texas Instruments to Gain Traction With New Charger ICs Zacks
TXN,2020-06-29 10:43:00,"The Zacks Analyst Blog Highlights: Alphabet, AT&T, Philip Morris International, Amazon, Microsoft, Texas Instruments and United Parcel Service Zacks"
TXN,2020-06-29 09:00:00,"New buck-boost battery chargers deliver 50% greater power density and three times faster charging for USB Type-C, USB PD and wireless dual-input charging PR Newswire"
TXN,2020-06-26 01:04:00,"Top Stock Reports for Alphabet, AT&T & Philip Morris Zacks"
TXN,2020-06-23 12:15:00,Texas Instruments recognizes 17 suppliers for excellence PR Newswire
TXN,2020-06-14 09:22:00,Better Buy: NVIDIA vs. Texas Instruments Motley Fool
TXN,2020-06-11 10:45:00,Texas Instruments Stock Falls 4% Investing.com -5.17%
TXN,2020-06-11 07:56:00,Worried About a Weak Dollar? Here's How to Trade & Win Zacks
TXN,2020-06-08 05:50:00,Texas Instruments (TXN) Gains But Lags Market: What You Should Know Zacks
TXN,2020-06-05 09:13:00,"Chip stocks are flying high, yet Wall Street still sees bargains MarketWatch"
TXN,2020-06-03 11:42:00,Chip Stocks Rally After Microchip Technology Boosts Outlook Barrons.com
TXN,2020-06-03 09:45:00,Chip Stocks Rally Despite USChina Tensions Investopedia
TXN,2020-06-02 06:59:00,US Indexes Close Higher Again Tuesday GuruFocus.com
TXN,2020-06-02 03:20:00,"Option Traders Make Big Bullish Bets On AMD, Texas Instruments Benzinga"
TXN,2020-06-02 12:27:00,These 2 charts show why record-high stock valuations shouldnt worry investors MarketWatch
TXN,2020-05-29 11:59:00,Here is What Hedge Funds Think About Texas Instruments Incorporated (TXN) Insider Monkey
TXN,2020-05-27 11:07:00,TI Vice President Dave Pahl to speak at Bank of America Securities investor conference PR Newswire
TXN,2020-05-26 01:38:00,Frank Sands Adds 5 Stocks to Portfolio GuruFocus.com
TXN,2020-05-23 01:26:00,Forget bonds here are 5 safe tech stocks offering dividends and growth MarketWatch
TXN,2020-05-21 11:30:00,Why Is Texas Instruments (TXN) Up 4.9% Since Last Earnings Report? Zacks
TXN,2020-05-17 08:29:00,3 Dividend-Paying Tech Stocks to Buy Right Now Motley Fool
TXN,2020-05-15 01:02:00,TI CEO Rich Templeton to speak at Bernstein investor conference PR Newswire
TXN,2020-10-07 09:00:00,New single-pair Ethernet PHY extends reach of factory and building automation applications PR Newswire
TXN,2020-10-07 08:59:00,6 Tech Stocks With Higher Dividend Yields Than the S&P 500 Barrons.com
TXN,2020-10-06 05:50:00,Texas Instruments (TXN) Stock Moves -0.16%: What You Should Know Zacks
TXN,2020-10-02 10:20:00,Texas Instruments to webcast Q3 2020 earnings conference call PR Newswire
TXN,2020-09-29 05:50:00,Texas Instruments (TXN) Stock Moves -0.31%: What You Should Know Zacks
TXN,2020-09-28 05:01:00,"Avnet, Inc. -- Moody's announces completion of a periodic review of ratings of Avnet, Inc. Moody's"
TXN,2020-09-28 03:23:00,Texas Instruments Incorporated's (NASDAQ:TXN) Stock Been Rising: Are Strong Financials Guiding The Market? Simply Wall St.
TXN,2020-09-28 10:27:00,Best Dividend Stocks for October 2020 Investopedia
TXN,2020-09-24 08:35:00,Is Texas Instruments Stock a Buy? Motley Fool
TXN,2020-09-22 05:50:00,Texas Instruments (TXN) Outpaces Stock Market Gains: What You Should Know Zacks
TXN,2020-09-21 12:45:00,Better Buy: Western Digital vs. Texas Instruments Motley Fool
TXN,2020-09-21 12:35:00,"Texas Instruments, Incorporated -- Moody's announces completion of a periodic review of ratings of Texas Instruments, Incorporated Moody's"
TXN,2020-09-21 07:08:00,Texas Instruments to Reward Investors With 13% Dividend Hike Zacks
TXN,2020-09-20 06:30:00,Investing in These Stocks Now Could Make You a Millionaire Retiree Motley Fool
TXN,2020-09-19 08:30:00,Microsoft and Texas Instruments Increase Their Dividends Barrons.com
TXN,2020-09-18 02:20:00,Texas Instruments To Hike Quarterly Dividend By 13% SmarterAnalyst
TXN,2020-09-17 04:24:00,Texas Instruments raises dividend by 13% MarketWatch
TXN,2020-09-17 04:01:00,TI to return more cash to shareholders with 13% dividend increase PR Newswire
TXN,2020-09-16 05:45:00,Texas Instruments (TXN) Dips More Than Broader Markets: What You Should Know Zacks
TXN,2020-09-15 08:00:00,The Argus Dividend Growth Portfolio Argus Research
TXN,2020-09-15 01:00:00,New PSpice® for TI tool helps engineers speed time to market with system-level circuit simulation and verification PR Newswire
TXN,2020-09-13 10:52:00,3 Stocks for an Electric Vehicle Future Not Named Tesla or Nikola Motley Fool
TXN,2020-09-10 05:50:00,Texas Instruments (TXN) Dips More Than Broader Markets: What You Should Know Zacks
TXN,2020-09-09 08:00:00,Seeking Direction After Hot Summer Argus Research
TXN,2020-09-09 11:30:00,Is Texas Instruments (TXN) Stock Outpacing Its Computer and Technology Peers This Year? Zacks
TXN,2020-09-08 07:02:00,Global Semiconductor Sales Rise YoY in July: 5 Stocks to Buy Zacks
TXN,2020-09-07 08:00:00,Why Texas Instruments Stock Rose 11.4% in August Motley Fool
TXN,2020-09-03 08:54:00,Texas Instruments (TXN) to Gain Traction With New Converters Zacks
TXN,2020-09-02 05:45:00,Texas Instruments (TXN) Outpaces Stock Market Gains: What You Should Know Zacks
TXN,2020-09-02 08:25:00,3 Dividend-Paying Tech Stocks to Buy Right Now Motley Fool
TXN,2020-09-01 01:27:00,"The Zacks Analyst Blog Highlights: Apple, Salesforce and Texas Instruments Zacks"
TXN,2020-09-01 09:00:00,TI introduces the industry's first DC/DC buck-boost converter to extend battery life by 50% and offer lowest IQ PR Newswire
TXN,2020-08-31 01:03:00,Hedge Funds Are Betting On Texas Instruments Incorporated (TXN) Insider Monkey
TXN,2020-08-27 03:11:00,Texas Instruments (NASDAQ:TXN) Has Gifted Shareholders With A Fantastic 243% Total Return On Their Investment Simply Wall St.
TXN,2020-08-27 01:50:00,TI CEO Rich Templeton to deliver keynote at Citi investor conference PR Newswire
TXN,2020-08-25 01:24:00,"Top Stock Reports for JNJ, Procter & Gamble & Thermo Fisher Zacks"
TXN,2020-08-25 09:15:00,Top Ranked Income Stocks to Buy for August 25th Zacks
TXN,2020-08-24 11:30:00,Is Texas Instruments (TXN) Outperforming Other Computer and Technology Stocks This Year? Zacks
TXN,2020-08-22 09:27:00,Barrons Stock Pick: Synaptics Makeover Could Lead to Dramatic Growth Barrons.com
TXN,2020-08-21 10:24:00,Top Ranked Income Stocks to Buy for August 21st Zacks
TXN,2020-08-21 09:15:00,Better Buy: NVIDIA vs. Texas Instruments Motley Fool
TXN,2020-08-20 11:30:00,Why Is Texas Instruments (TXN) Up 4.5% Since Last Earnings Report? Zacks
TXN,2020-08-20 10:24:00,"The Zacks Analyst Blog Highlights: Maxim Integrated Products, Analog Devices, Texas Instruments and NVIDIA Zacks"
TXN,2020-08-20 10:04:00,"Zacks Earnings Trends Highlights: Texas Instruments, Advanced Micro Devices, Whirlpool and Cognizant Zacks"
TXN,2020-08-19 09:33:00,"Got $3,000 to Invest? These 3 IoT Stocks Could Make You a Fortune Motley Fool"
TXN,2020-08-19 12:01:00,Understanding Texas Instruments's Unusual Options Activity Benzinga
TXN,2020-08-19 09:42:00,Semiconductor-General Stock Outlook: Moderately Positive Prospects Zacks
TXN,2020-08-19 07:04:00,Red-Hot NVIDIA & Other Chip Bigwigs to Add to Your Portfolio Zacks
TXN,2020-08-18 04:01:00,Haviv Ilan named chief operating officer of TI PR Newswire
TXN,2020-08-14 10:41:00,"Grocery Outlet, Wix.com, Texas Instruments, Etsy and Teradyne highlighted as Zacks Bull and Bear of the Day Zacks"
TXN,2020-08-13 04:03:00,3 Growth Stocks with the Highest Zacks Rank Zacks
TXN,2020-08-13 12:21:00,"Zacks Earnings Trends Highlights: Texas Instruments, AMD, Whirlpool and Cognizant Zacks"
TXN,2020-08-10 07:00:00,"A Big Fund Manager Sold Berkshire, Verizon and GE Stock. It Bought This Chip Stock. Barrons.com"
TXN,2020-08-07 11:30:00,Has Texas Instruments (TXN) Outpaced Other Computer and Technology Stocks This Year? Zacks
TXN,2020-08-06 11:10:00,Semiconductor ETFs Roaring to New Highs on Solid Earnings Zacks
TXN,2020-08-06 08:45:00,"Zacks Earnings Trends Highlights: Texas Instruments, Advanced Micro Devices, Whirlpool and Cognizant Zacks"
TXN,2020-08-05 03:00:00,Texas Instruments Rises Amid Coronavirus Market Recovery; Can It Sustain The Gain? Investor's Business Daily
TXN,2020-08-03 11:22:00,"The Zacks Analyst Blog Highlights: Shopify, T-Mobile US, Texas Instruments, Asure and Calix Zacks"
TXN,2020-08-02 06:53:00,10 US Companies With Highest Revenue Exposure To China Insider Monkey
TXN,2020-08-02 05:30:00,3 Stocks for a Better Retirement Motley Fool
TXN,2020-07-31 08:00:00,Trane Stock: a Very Cool Pick Barrons.com
TXN,2020-07-30 11:52:00,10 Biggest Semiconductor Companies Investopedia
TXN,2020-07-30 11:17:00,"Zacks Earnings Trends Highlights: Texas Instruments, JPMorgan, Whirlpool and Goldman Sachs Zacks"
TXN,2020-07-28 08:43:00,"The Zacks Analyst Blog Highlights: Facebook, Alphabet, Texas Instruments, Dollar General and Kroger Zacks"
TXN,2020-07-27 02:15:00,"SWKS, STM or TXN: Which Looks Best Post-Earnings? Zacks"
TXN,2020-07-27 11:30:00,Why Texas Instruments Is a Great Dividend Stock Motley Fool
TXN,2020-07-27 10:45:00,Tech Analyst Says Valuations Hit a Wall Following Recent Gains Bloomberg
TXN,2020-07-26 10:00:00,Only Three Days Left To Cash In On Texas Instruments' (NASDAQ:TXN) Dividend Simply Wall St.
TXN,2020-07-23 10:42:00,"Zacks Earnings Trends Highlights: Texas Instruments, JPMorgan, Whirlpool and Goldman Sachs Zacks"
TXN,2020-07-23 07:10:00,Like Dividends? I Bet You'll Love These 3 Stocks. Motley Fool
TXN,2020-07-23 04:51:00,"STMicro Raises 3Q, FY Guidance on Improved Market Conditions Bloomberg"
TXN,2020-07-22 02:37:00,Let's Try to Graph Out Texas Instruments' Correction TheStreet.com
TXN,2020-07-22 01:54:00,"AMD, IBM, Texas Instruments: Tech Stock Midday Movers TheStreet.com"
TXN,2020-07-22 11:30:00,Is Texas Instruments (TXN) Stock Outpacing Its Computer and Technology Peers This Year? Zacks
TXN,2020-07-22 10:33:00,China will be pulled back to top of investor concerns after earnings season: Strategist Yahoo Finance Video
TXN,2020-07-22 10:05:00,"Texas Instruments (TXN) Q2 Earnings Beat, Revenues Down Y/Y Zacks"
TXN,2020-07-22 09:56:00,"Dow Jones Today, Stocks Turn Higher: Tesla, Microsoft Rise Ahead Of Earnings; Pfizer Spikes On HHS Vaccine Deal Investor's Business Daily"
TXN,2020-07-22 09:43:00,"Taiwan Semiconductor Manufacturing Company, Boot Barn, Snap, Texas Instruments and TD Ameritrade highlighted as Zacks Bull and Bear of the Day Zacks"
TXN,2020-07-22 09:35:00,"Benzinga's Top Upgrades, Downgrades For July 22, 2020 Benzinga"
TXN,2020-07-22 09:07:00,Is There Now An Opportunity In Texas Instruments Incorporated (NASDAQ:TXN)? Simply Wall St.
TXN,2020-07-22 08:55:00,Texas Instruments' Debt Overview Benzinga
TXN,2020-07-22 08:14:00,Dow Jones Futures Fall 100 Points On U.S.-China Tensions; Pfizer Soars 5% On Coronavirus Vaccine Deal Investor's Business Daily
TXN,2020-07-22 03:47:00,Texas Instruments Provides Upbeat Sales Outlook; Top Analyst Sees 18% Upside SmarterAnalyst
TXN,2020-07-21 09:00:00,Texas Instruments Inc (TXN) Q2 2020 Earnings Call Transcript Motley Fool
TXN,2020-07-21 08:24:00,[video]6 Key Takeaways from Texas Instruments' Earnings Report and Call TheStreet.com
TXN,2020-07-21 07:13:00,Texas Instruments Gives Strong Forecast But Urges Caution Bloomberg
TXN,2020-07-21 05:44:00,Texas Instruments Q2 Earnings Beat Forecasts TheStreet.com
TXN,2020-07-21 05:25:00,Texas Instruments (TXN) Q2 Earnings and Revenues Surpass Estimates Zacks
TXN,2020-07-21 05:08:00,"Chipmaker Texas Instruments Tops Second-Quarter Targets, Guides Higher Investor's Business Daily"
TXN,2020-07-21 05:05:00,Recap: Texas Instruments Q2 Earnings Benzinga
TXN,2020-07-21 04:49:00,Texas Instruments Stock Is Rising Because Earnings Crushed Expectations Barrons.com
TXN,2020-07-21 04:12:00,"Texas Instruments stock rises on earnings, outlook beat MarketWatch"
TXN,2020-07-21 04:01:00,TI reports second quarter 2020 financial results and shareholder returns PR Newswire
TXN,2020-07-21 01:50:00,A Look Into Texas Instruments' Debt Benzinga
TXN,2020-07-21 08:57:00,"The Zacks Analyst Blog Highlights: Texas Instruments, Teradyne, Intel, MaxLinear and NXP Semiconductors Zacks"
TXN,2020-07-21 06:05:00,Big Earnings Week for Chip Bellwethers: 2 Solid Buys Zacks
TXN,2020-07-20 08:52:00,Can Texas Instruments Sustain Its Earnings Beat Trend in Q2? Zacks
TXN,2020-07-20 08:50:00,Is a Surprise Coming for Texas Instruments (TXN) This Earnings Season? Zacks
TXN,2020-07-17 09:28:00,What's in Store for Texas Instruments' (TXN) Q2 Earnings? Zacks
TXN,2020-09-28 05:01:00,"Avnet, Inc. -- Moody's announces completion of a periodic review of ratings of Avnet, Inc. Moody's"
TXN,2020-09-28 03:23:00,Texas Instruments Incorporated's (NASDAQ:TXN) Stock Been Rising: Are Strong Financials Guiding The Market? Simply Wall St.
TXN,2020-09-28 10:27:00,Best Dividend Stocks for October 2020 Investopedia
TXN,2020-09-24 08:35:00,Is Texas Instruments Stock a Buy? Motley Fool
TXN,2020-09-22 05:50:00,Texas Instruments (TXN) Outpaces Stock Market Gains: What You Should Know Zacks
TXN,2020-09-21 12:45:00,Better Buy: Western Digital vs. Texas Instruments Motley Fool
TXN,2020-09-21 12:35:00,"Texas Instruments, Incorporated -- Moody's announces completion of a periodic review of ratings of Texas Instruments, Incorporated Moody's"
TXN,2020-09-21 07:08:00,Texas Instruments to Reward Investors With 13% Dividend Hike Zacks
TXN,2020-09-20 06:30:00,Investing in These Stocks Now Could Make You a Millionaire Retiree Motley Fool
TXN,2020-09-19 08:30:00,Microsoft and Texas Instruments Increase Their Dividends Barrons.com
TXN,2020-09-18 02:20:00,Texas Instruments To Hike Quarterly Dividend By 13% SmarterAnalyst
TXN,2020-09-17 04:24:00,Texas Instruments raises dividend by 13% MarketWatch
TXN,2020-09-17 04:01:00,TI to return more cash to shareholders with 13% dividend increase PR Newswire
TXN,2020-09-16 05:45:00,Texas Instruments (TXN) Dips More Than Broader Markets: What You Should Know Zacks
TXN,2020-09-15 08:00:00,The Argus Dividend Growth Portfolio Argus Research
TXN,2020-09-15 01:00:00,New PSpice® for TI tool helps engineers speed time to market with system-level circuit simulation and verification PR Newswire
TXN,2020-09-13 10:52:00,3 Stocks for an Electric Vehicle Future Not Named Tesla or Nikola Motley Fool
TXN,2020-09-10 05:50:00,Texas Instruments (TXN) Dips More Than Broader Markets: What You Should Know Zacks
TXN,2020-09-09 08:00:00,Seeking Direction After Hot Summer Argus Research
TXN,2020-09-09 11:30:00,Is Texas Instruments (TXN) Stock Outpacing Its Computer and Technology Peers This Year? Zacks
TXN,2020-09-08 07:02:00,Global Semiconductor Sales Rise YoY in July: 5 Stocks to Buy Zacks
TXN,2020-09-07 08:00:00,Why Texas Instruments Stock Rose 11.4% in August Motley Fool
TXN,2020-09-03 08:54:00,Texas Instruments (TXN) to Gain Traction With New Converters Zacks
TXN,2020-09-02 05:45:00,Texas Instruments (TXN) Outpaces Stock Market Gains: What You Should Know Zacks
TXN,2020-09-02 08:25:00,3 Dividend-Paying Tech Stocks to Buy Right Now Motley Fool
TXN,2020-09-01 01:27:00,"The Zacks Analyst Blog Highlights: Apple, Salesforce and Texas Instruments Zacks"
TXN,2020-09-01 09:00:00,TI introduces the industry's first DC/DC buck-boost converter to extend battery life by 50% and offer lowest IQ PR Newswire
TXN,2020-08-31 01:03:00,Hedge Funds Are Betting On Texas Instruments Incorporated (TXN) Insider Monkey
TXN,2020-08-27 03:11:00,Texas Instruments (NASDAQ:TXN) Has Gifted Shareholders With A Fantastic 243% Total Return On Their Investment Simply Wall St.
TXN,2020-08-27 01:50:00,TI CEO Rich Templeton to deliver keynote at Citi investor conference PR Newswire
TXN,2020-08-25 01:24:00,"Top Stock Reports for JNJ, Procter & Gamble & Thermo Fisher Zacks"
TXN,2020-08-25 09:15:00,Top Ranked Income Stocks to Buy for August 25th Zacks
TXN,2020-08-24 11:30:00,Is Texas Instruments (TXN) Outperforming Other Computer and Technology Stocks This Year? Zacks
TXN,2020-08-22 09:27:00,Barrons Stock Pick: Synaptics Makeover Could Lead to Dramatic Growth Barrons.com
TXN,2020-08-21 10:24:00,Top Ranked Income Stocks to Buy for August 21st Zacks
TXN,2020-08-21 09:15:00,Better Buy: NVIDIA vs. Texas Instruments Motley Fool
TXN,2020-08-20 11:30:00,Why Is Texas Instruments (TXN) Up 4.5% Since Last Earnings Report? Zacks
TXN,2020-08-20 10:24:00,"The Zacks Analyst Blog Highlights: Maxim Integrated Products, Analog Devices, Texas Instruments and NVIDIA Zacks"
TXN,2020-08-20 10:04:00,"Zacks Earnings Trends Highlights: Texas Instruments, Advanced Micro Devices, Whirlpool and Cognizant Zacks"
TXN,2020-08-19 09:33:00,"Got $3,000 to Invest? These 3 IoT Stocks Could Make You a Fortune Motley Fool"
TXN,2020-08-19 12:01:00,Understanding Texas Instruments's Unusual Options Activity Benzinga
TXN,2020-08-19 09:42:00,Semiconductor-General Stock Outlook: Moderately Positive Prospects Zacks
TXN,2020-08-19 07:04:00,Red-Hot NVIDIA & Other Chip Bigwigs to Add to Your Portfolio Zacks
TXN,2020-08-18 04:01:00,Haviv Ilan named chief operating officer of TI PR Newswire
TXN,2020-08-14 10:41:00,"Grocery Outlet, Wix.com, Texas Instruments, Etsy and Teradyne highlighted as Zacks Bull and Bear of the Day Zacks"
TXN,2020-08-13 04:03:00,3 Growth Stocks with the Highest Zacks Rank Zacks
TXN,2020-08-13 12:21:00,"Zacks Earnings Trends Highlights: Texas Instruments, AMD, Whirlpool and Cognizant Zacks"
TXN,2020-08-10 07:00:00,"A Big Fund Manager Sold Berkshire, Verizon and GE Stock. It Bought This Chip Stock. Barrons.com"
TXN,2020-08-07 11:30:00,Has Texas Instruments (TXN) Outpaced Other Computer and Technology Stocks This Year? Zacks
TXN,2020-08-06 11:10:00,Semiconductor ETFs Roaring to New Highs on Solid Earnings Zacks
TXN,2020-08-06 08:45:00,"Zacks Earnings Trends Highlights: Texas Instruments, Advanced Micro Devices, Whirlpool and Cognizant Zacks"
TXN,2020-08-05 03:00:00,Texas Instruments Rises Amid Coronavirus Market Recovery; Can It Sustain The Gain? Investor's Business Daily
