,0,1
0,Oct-09-20 07:46PM,Browns Returns Beat the Big Boys of the Ivy League Barrons.com
1,Oct-08-20 02:27PM,"The Zacks Analyst Blog Highlights: Cisco, Intel, AMD, TSMC and IBM Zacks"
2,12:34PM,Shark Tank star Daymond John: We should be building businesses Yahoo Finance
3,10:41AM,Daymond John partners with Chase for Business to create the first Black Entrepreneurs Day Yahoo Finance Video
4,10:39AM,Cisco Teams Up With Verizon to Boost Fan Experience On-Site Zacks
5,10:30AM,Just 28% of Americans Expect Return to Workplace Before 2021 Bloomberg
6,08:00AM,"Cisco, Qwilt and Digital Alpha Define the Future of Content Delivery with New Open Caching Solution for Service Providers GlobeNewswire"
7,08:00AM,Cisco signs up BT for new service to speed up video streaming Reuters
8,Oct-07-20 03:37PM,Value In Legacy Tech: 3 Stocks To Watch Zacks
9,08:59AM,6 Tech Stocks With Higher Dividend Yields Than the S&P 500 Barrons.com
10,08:00AM,"Verizon Business and Cisco Bringing 5G-Enabled, MEC Solutions to Sports and Entertainment Venues GlobeNewswire"
11,Oct-06-20 06:03PM,Companies to Shrink Offices as Remote Work Becomes New Normal Bloomberg
12,05:45PM,Cisco Systems (CSCO) Flat As Market Sinks: What You Should Know Zacks
13,05:14AM,Cisco Hit With $1.9B Fine In Centripetal Patent Lawsuit Report SmarterAnalyst
14,01:35AM,"Cisco Penalized $1.9B In Cybersecurity Infringement Trial, Plans Appeal Benzinga"
15,Oct-05-20 08:16PM,Cisco Ordered to Pay $1.9 Billion in Patent Lawsuit Motley Fool
16,04:31PM,Cisco Told to Pay $1.9 Billion in Security-Patent Trial Loss Bloomberg
17,03:32PM,"Cisco is ordered to pay $1.9 billion in U.S. patent lawsuit, plans appeal Reuters"
18,02:33PM,Cisco to Acquire Portshift to Boost Container Apps Security Zacks
19,10:00AM,Cisco's Webex Upgrades Boost Enterprise Communication Space Zacks
20,07:49AM,"Nvidia, Dominos, Cisco, Levis, and Other Stocks to Watch This Week Barrons.com"
21,Oct-04-20 04:30PM,"Here's How Much Investing $1,000 In The 5 Biggest Dot-Com Bubble Tech Stocks Would Be Worth Today Benzinga"
22,Oct-02-20 08:33PM,"In a Pandemic Year, Amazon and Target Schedule Their Big Holiday Salesin Mid-October Barrons.com"
23,12:41PM,Intel Stock Is a Tremendous Value at $50 InvestorPlace
24,12:41PM,Intel Stock Is a Tremendous Value at $50 CoinDesk
25,10:30AM,2 Cheap Stocks to Buy Before the 2020 Election Motley Fool
26,08:51AM,"Here's How Much Investing $1,000 In Cisco At Dot-Com Bubble Peak Would Be Worth Today Benzinga"
27,Oct-01-20 11:12AM,Not Every Value Stock Is a Good One Kiplinger
28,10:36AM,Another Acronym Cybersecurity Stock Investors Need To Know Investor's Business Daily
29,09:33AM,Cisco acquires PortShift to raise its game in DevOps and Kubernetes security TechCrunch
30,Sep-30-20 05:45PM,Cisco Systems (CSCO) Outpaces Stock Market Gains: What You Should Know Zacks
31,12:45PM,Arista Networks to Seize Cybersecurity Opportunity With Acquisition of Awake Security Motley Fool
32,10:43AM,Analyzing Cisco Systems's Unusual Options Activity Benzinga
33,Sep-29-20 05:31PM,"Juniper Networks, Inc. -- Moody's announces completion of a periodic review of ratings of Juniper Networks, Inc. Moody's"
34,05:30PM,"Cisco Systems, Inc. -- Moody's announces completion of a periodic review of ratings of Cisco Systems, Inc. Moody's"
35,Sep-28-20 11:18AM,U.S. Moved Against a Chinese Chip Maker. It Could Have Been Much Worse. Barrons.com
36,Sep-26-20 10:08AM,"Is It Time To Consider Buying Cisco Systems, Inc. (NASDAQ:CSCO)? Simply Wall St."
37,Sep-25-20 08:50AM,Apple Stock Really Cant Go Much Higher. Buy These Tech Stocks Instead. Barrons.com
38,Sep-24-20 05:45PM,Cisco Systems (CSCO) Stock Sinks As Market Gains: What You Should Know Zacks
39,10:46AM,"Dow's nearly 50-point fall led by losses in shares of Boeing, Nike MarketWatch"
40,08:00AM,"Cisco to Participate in Cowen's Networking Leaders, Legends, Luminaries, and Visionaries Fireside Chat Series PR Newswire"
41,Sep-23-20 10:02PM,"After controversy, Cisco commits $100 million to broad social-justice pledge, including increasing Black workers and leadership MarketWatch"
42,07:12PM,Unifor welcomes economic and social pandemic support in Throne Speech CNW Group
43,05:35PM,P&G Will Rename Skin Creams at Minimum: Equality Summit Update Bloomberg
44,04:17PM,"Microsoft, Facebook Data Center Upgrades Could Boost Arista Stock, Cisco Investor's Business Daily"
45,12:37PM,Cisco Promises to Increase Black Representation in Workforce Bloomberg
46,11:49AM,Western Digital Stock Spikes On Speculation It May Split Into Two Barrons.com
47,10:32AM,Investors Shouldn't Worry About Cisco's Blacklist Risks in China Motley Fool
48,Sep-22-20 10:29PM,Blacklisting U.S. Tech Would Highlight Chinas Own Weakness Bloomberg
49,01:29PM,"Top Stock Reports for Mastercard, Disney & Bank of America Zacks"
50,Sep-19-20 08:45AM,Where Will Cisco Systems Be in 5 Years? Motley Fool
51,Sep-18-20 10:48AM,"Apple Inc., Cisco share losses lead the way, but Dow flat MarketWatch"
52,09:27AM,Forget Penny Stocks -- Cisco Systems Is a Cheap Stock to Buy Now Motley Fool
53,07:40AM,The TikTok Failure Doesnt Really Hurt the Case for Microsoft Stock InvestorPlace
54,06:00AM,"Huawei Ban Spurs New Competition for Ericsson, Nokia Bloomberg"
55,Sep-17-20 05:45PM,Cisco Systems (CSCO) Stock Moves -0.12%: What You Should Know Zacks
56,09:50AM,Is Cisco Stock A Buy Or Sell? Tech Icon May Need Big Acquisition Amid Covid-19 Investor's Business Daily
57,Sep-16-20 10:26AM,Understanding Cisco Systems's Unusual Options Activity Benzinga
58,Sep-11-20 01:29PM,7 Nasdaq Stocks You Need To Buy Before They Bounce Back Up InvestorPlace
59,11:30AM,Cisco (CSCO) Down 7.4% Since Last Earnings Report: Can It Rebound? Zacks
60,08:00AM,Not This Again: 11 Big Stocks 'Double Dip' Back Into The Red Investor's Business Daily
61,Sep-10-20 02:05PM,10 Biggest Tech Hardware Companies Investopedia
62,10:22AM,Better Buy: Arista Networks vs. Cisco Systems Motley Fool
63,Sep-09-20 04:15PM,Cisco Declares Quarterly Cash Dividend PR Newswire
64,09:00AM,MuralNet and Cisco Launch Sustainable Tribal Networks Program Business Wire
65,08:00AM,Cisco Research Finds Small Businesses Can Add $2.3T to Global GDP Growth by 2024 PR Newswire
66,Sep-05-20 02:00PM,Better Buy: Zoom Video Communications vs. Cisco Systems Motley Fool
67,Sep-03-20 06:22PM,"Analyst Report: Cisco Systems, Inc. Morningstar Research"
68,03:02PM,"Cisco Systems, Inc. (NASDAQ:CSCO) Stock's Been Sliding But Fundamentals Look Decent: Will The Market Correct The Share Price In The Future? Simply Wall St."
69,10:08AM,Understanding Cisco Systems's Unusual Options Activity Benzinga
70,08:38AM,Why Cisco Systems Stock Fell 10.4% in August Motley Fool
71,Sep-02-20 08:25AM,3 Dividend-Paying Tech Stocks to Buy Right Now Motley Fool
72,Sep-01-20 04:40PM,Dynatrace Stock Breaks Out; Its Software Monitors Business-Critical Apps Investor's Business Daily
73,Aug-31-20 02:14PM,"Is Cisco Systems, Inc. (CSCO) Going to Burn These Hedge Funds? Insider Monkey"
74,08:00AM,Cisco Announces September 2020 Events with the Financial Community PR Newswire
75,Aug-30-20 07:00AM,A Huge Sovereign-Wealth Fund Made a Big Bet on GE Stock. Heres What It Sold. Barrons.com
76,Aug-28-20 01:56PM,"Zacks Value Trader Highlights: Disney, Cisco and Bank of America Zacks"
77,09:12AM,Zoom Investors Should Pay Attention to Cisco's Latest Acquisition Motley Fool
78,08:52AM,Why Zoom Communications Is Still a Sizzling Hot Trade InvestorPlace
79,Aug-27-20 10:21AM,Unusual Options Activity Insight: Cisco Systems Benzinga
80,10:02AM,"Walmart, Starbucks and a growing number of U.S. companies set to give workers time off to vote MarketWatch"
81,Aug-26-20 02:23PM,Dow Jones Misses Out on Massive Salesforce Rally; Cisco Makes Videoconferencing Acquisition Motley Fool
82,12:52PM,Cisco (CSCO) to Buy BabbleLabs to Augment Webex Experience Zacks
83,09:08AM,Cisco acquiring BabbleLabs to filter out the lawn mower screeching during your video conference TechCrunch
84,03:34AM,Cisco Buying BabbleLabs To Boost Video Meeting Experience SmarterAnalyst
85,Aug-25-20 04:43PM,Cisco Systems says it plans to acquire BabbleLabs MarketWatch
86,04:15PM,Cisco Announces Intent To Acquire BabbleLabs To Improve Video Meeting Experience PR Newswire
87,Aug-24-20 11:21AM,Salesforce (CRM) Risky to Buy at Current Levels Investopedia
88,Aug-22-20 09:20AM,Should Investors Worry About Cisco Stock? Motley Fool
89,Aug-21-20 12:04PM,7 Safe Stocks to Buy That Can Shrug Off the Growing Volatility InvestorPlace
90,Aug-20-20 11:16AM,2 Stock-Option Strategies That Split the Difference Between Fear and Greed Barrons.com
91,10:39AM,"Zacks Market Edge Highlights: Walmart, Home Depot, Mastercard, Cisco Systems and Western Digital Zacks"
92,Aug-19-20 08:00AM,Ping Beware: Riot Games Partners With Cisco To Power LoL Esports PR Newswire
93,Aug-18-20 08:05AM,"NASDAQ: CSCO Shareholder Notice: Lawsuit against Cisco Systems, Inc. over alleged discrimination announced by Shareholders Foundation GlobeNewswire"
94,Aug-17-20 06:05AM,RPT-BUZZ-U.S. stocks weekly: High level flirting Reuters
95,04:00AM,"AppDynamics Announces SAP Peak, Delivering Deep Visibility Into SAP Landscapes With Real-Time Business Context Business Wire"
96,Aug-16-20 02:00PM,"If You Like Dividends, You Should Love These 3 Stocks Motley Fool"
97,11:00AM,6 Bright Spots in Cisco's Disappointing Q4 Report Motley Fool
98,Aug-14-20 06:44PM,Tech Stocks Arent Immune to Covid-19. Ciscos Earnings Showed Us Why. Barrons.com
99,03:30PM,The 3 Best Dow Jones Stocks to Trade Today InvestorPlace
