,0,1
0,Oct-09-20 06:45AM,Bull of the Day: Lowe's Companies (LOW) Zacks
1,Oct-08-20 12:34PM,Shark Tank star Daymond John: We should be building businesses Yahoo Finance
2,08:17AM,"Lowe's (LOW) Enhances Bonus, Supports Employees Amid Pandemic Zacks"
3,Oct-07-20 06:11PM,Lowe's Prices $4 Billion Notes Offering PR Newswire
4,03:00PM,Media Advisory - Government of Canada to make important announcement on moving goods to international markets CNW Group
5,09:30AM,Lowe's Canada provides additional discretionary bonus to support front-line hourly associates CNW Group
6,08:34AM,Lowe's to spend $100 million for an additional pandemic bonus for workers MarketWatch
7,08:28AM,Lowe's Announces Cash Tender Offers For Certain Of Its Outstanding Debt Securities PR Newswire
8,08:15AM,"Lowe's Provides Additional Bonus To Support Associates, Increasing Pandemic Commitment To More Than $775 Million PR Newswire"
9,Oct-05-20 09:00AM,Trick-or-Treating Isn't Cancelled This Year -- Thanks to Lowe's Curbside Events Nationwide PR Newswire
10,Oct-03-20 11:03AM,8 Stocks That Will Benefit as Consumers Keep Staying Indoors Barrons.com
11,08:00AM,"D.R. Horton, LGI Homes In Buy Range, Lowe's Sets Up As Coronavirus Fuels Housing Stocks Investor's Business Daily"
12,Oct-02-20 04:18PM,COMM 2012-CCRE1 Mortgage Trust -- Moody's affirms six and downgrades five classes of COMM 2012-CCRE1 Moody's
13,12:45PM,3 Reasons Growth Investors Will Love Lowe's (LOW) Zacks
14,11:51AM,Lowe's Gains From Home Improvement Business & Online Sales Zacks
15,Sep-30-20 06:31AM,RONA and Reno-Depot are hiring to fill over 625 positions in Quebec CNW Group
16,Sep-29-20 05:10PM,Citigroup Commercial Mortgage Trust 2016-C1 -- Moody's affirms nine classes of CGCMT 2016-C1 Moody's
17,08:36AM,Is Lowe's (LOW) Stock a Solid Choice Right Now? Zacks
18,Sep-28-20 11:16AM,"Americans are using discretionary dollars to remodel their homes, here's how Yahoo Finance Video"
19,Sep-25-20 01:07PM,5 Cyclical Companies Outperforming the S&P 500 GuruFocus.com
20,Sep-23-20 12:58PM,A Trio of Stocks for the Value Investor GuruFocus.com
21,11:51AM,Lowes Stock Can Keep Rallying Because People Will Be Spending More Time at Home for Longer Barrons.com
22,10:02AM,"IBD 50 Stock Crafts Buy Point With NFL, 'Shark Tank' Deals Investor's Business Daily"
23,09:00AM,Aboard a Winnebago in Search of Better Angels Bloomberg
24,Sep-22-20 11:33AM,Lowe's launching pickup lockers at all U.S. stores by March 2021 MarketWatch
25,07:05AM,Lowe's Leverages Innovative Technology to Launch Contactless Pickup Lockers Nationwide PR Newswire
26,Sep-21-20 07:00AM,Can Home Depot and Lowes Stock Continue Rallying? Barrons.com
27,04:03AM,"LEB Holdings (USA), Inc. -- Moody's assigns B3 rating to Barrette Outdoor Living's term loan, B2 CFR assigned; outlook stable Moody's"
28,Sep-20-20 07:22AM,Lowe`s (LOW) and Home Depot (HD): Oppenheimers Concerns About Near-Term Future Insider Monkey
29,Sep-18-20 03:46PM,"Oppenheimer downgrades Home Depot, Lowes on a post-pandemic reset in home improvement retail Yahoo Finance Video"
30,12:05PM,5 Cyclical Companies Trading With Low Price-Sales Ratios GuruFocus.com
31,11:30AM,Why Is Lowe's (LOW) Up 3.3% Since Last Earnings Report? Zacks
32,Sep-16-20 12:45PM,3 Reasons Why Lowe's (LOW) Is a Great Growth Stock Zacks
33,12:20PM,Earnings Estimates Rising for Lowe's (LOW): Will It Gain? Zacks
34,09:56AM,Lowe's Companies (NYSE:LOW) Has Gifted Shareholders With A Fantastic 170% Total Return On Their Investment Simply Wall St.
35,08:58AM,Retail Sales Come In Soft After Fiscal Stimulus Lapses; Dow Jones Futures Pare Gain Investor's Business Daily
36,Sep-15-20 12:15PM,Home Depot co-founder and Atlanta Falcons owner's best advice for New York Mets owner Steve Cohen Yahoo Finance
37,09:38AM,"Lowe's Offers Chance of a Lifetime to Hundreds of Diverse Small Businesses with Virtual Pitch Program, hosted by Shark Tank's Daymond John PR Newswire"
38,06:00AM,Shoppers Drug Mart to expand Canadians' access to virtual care through $75 million investment in Maple CNW Group
39,Sep-14-20 03:00PM,IBD 50 Stocks To Watch: Why Lowe's Has Established A Second Buy Point Investor's Business Daily
40,Sep-11-20 09:46PM,Fashion designer Rebecca Minkoff on 2020 NYFW going virtual Yahoo Finance Video
41,Sep-10-20 01:31PM,Black Friday shopping like we all know it is officially over because of COVID-19 Yahoo Finance
42,09:02AM,Restoration Hardware Stock Pops After Strong Earnings and an Upgrade Barrons.com
43,05:53AM,"Restoration Hardware Up as Brand Turns Luxe, Strength Ahead Investing.com"
44,Sep-09-20 05:36PM,RH Stock Jumps After Earnings. Everyones Still Spending on Their Homes. Barrons.com
45,09:00AM,"Lowe's Unites NFL Fans with a New Type of ""Home Team"" PR Newswire"
46,Sep-07-20 05:00AM,Is the Stock Market Open Today? Here Are the Hours for Labor Day 2020. Barrons.com
47,Sep-05-20 08:00AM,Nike Leads 5 Stocks To Watch As Market Whipsaws Investor's Business Daily
48,Sep-04-20 08:11AM,Why Lowe's Stock Rose 11% in August Motley Fool
49,Sep-03-20 11:52AM,"Lowes (LOW) Has Risen 43% in Last One Year, Outperforms Market Insider Monkey -5.26%"
50,Sep-02-20 09:00AM,Lowe's to Present at the Goldman Sachs 27th Annual Global Retailing Virtual Conference PR Newswire
51,Sep-01-20 09:55AM,Lowe's Pledges $1 Million To Support American Red Cross Disaster Relief And Other Local Response Efforts In Wake Of Hurricane Laura PR Newswire
52,Aug-31-20 04:20PM,Bill Ackman Thinks His Portfolio Is Well Positioned GuruFocus.com
53,11:49AM,Should Value Investors Buy Lowes Companies (LOW) Stock? Insider Monkey
54,Aug-29-20 11:35PM,"ATRI, LOW, CBU, AFG Rewarding Shareholders With Higher Payouts Insider Monkey"
55,11:53AM,Lowes Companies (LOW) Dividend Stock Analysis For 2020 Insider Monkey
56,Aug-28-20 03:28PM,"Ackman sees more gains for his portfolio, urges stock ownership for all Americans Reuters"
57,Aug-27-20 10:48AM,"Home Depot, Lowe's and Tractor Supply among the retailers getting a bump in demand from hurricane season MarketWatch"
58,08:15AM,Lowe's Expanded Tool Rental Business Isn't Really About Tool Rentals Motley Fool
59,07:34AM,Hurricane Laura Makes Landfall. Oil Markets Shrug. Barrons.com
60,Aug-26-20 02:04PM,How Tool Rentals Could Become a Big Business at Lowes Barrons.com
61,10:38AM,Best Dividend Stocks for September 2020 Investopedia
62,Aug-25-20 01:50PM,3 simple reasons behind America's housing boom Yahoo Finance
63,12:10PM,Lowe's Stock Trades to an All-Time High on Earnings Investopedia
64,09:43AM,Why Best Buys Pandemic Bounce Fell Short of Targets Bloomberg
65,09:30AM,New York Fashion Week Is Going Home...With Lowe's PR Newswire
66,Aug-24-20 11:31AM,3 Ways Lowe's Topped Home Depot This Quarter Motley Fool
67,10:16AM,Lowe's Entices Investors With 9% Hike in Quarterly Dividend Zacks
68,06:07AM,RPT-BUZZ-U.S. stocks weekly: New bull in town Reuters
69,Aug-23-20 01:30AM,Lowes Hikes Quarterly Cash Dividend By 9% After 2Q Surprises Investors SmarterAnalyst
70,Aug-21-20 07:11PM,"Housing Numbers Rise, and Lowes and Home Depot Stock Follow Barrons.com"
71,04:30PM,"Lowe's Companies, Inc. raises quarterly cash dividend by 9% to $0.60 per share PR Newswire"
72,04:18PM,'A really tough spot' for employees: How companies are enforcing mask compliance Yahoo Finance
73,02:13PM,"Could The Lowe's Companies, Inc. (NYSE:LOW) Ownership Structure Tell Us Something Useful? Simply Wall St."
74,Aug-20-20 04:14PM,Lowe's Is Outperforming Home Depot GuruFocus.com
75,03:29PM,Strong Online Sales Boost Lowe's 2nd-Quarter Results GuruFocus.com
76,12:38PM,"Lowes targets professionals, and its main competitor Home Depot, with new services MarketWatch"
77,10:41AM,US Indexes Close Lower Wednesday GuruFocus.com
78,09:24AM,Home Depot vs Lowes: Which Stock Looks Stronger After A Stellar Q2? SmarterAnalyst
79,07:00AM,Lowe's (LOW) Q2 2020 Earnings Call Transcript Motley Fool
80,05:54AM,"Sometimes, the stock market makes a lot of sense: Morning Brief Yahoo Finance"
81,Aug-19-20 05:07PM,Stock Market Today: The New Bull Market Starts With a Limp Kiplinger
82,04:58PM,"Target online sales climb 195% in 2nd quarter, profits jump 80% Yahoo Finance Video"
83,04:52PM,US STOCKS-Wall Street ends lower after Fed minutes highlight tough recovery Reuters
84,04:32PM,Dow Jones Drifts Lower On Fed Coronavirus Worries; Amazon Nears Buy Zone Investor's Business Daily
85,04:00PM,US STOCKS-Wall Street ends lower after Fed minutes highlight difficult economic recovery Reuters
86,03:29PM,"US STOCKS-S&P 500, Nasdaq slide from record highs after Fed minutes Reuters"
87,01:17PM,"US STOCKS-S&P 500, Nasdaq hit record highs as Apple crosses $2 trillion mark Reuters"
88,12:57PM,PreMarket Prep Stock Of The Day: Lowe's Benzinga
89,12:37PM,Lowe's Reports Outstanding Fiscal Q2 Results as Consumers Turn to Home Improvement Motley Fool
90,12:09PM,"Dow Jones Up As Apple Stock Makes History; S&P 500, Nasdaq Hit New Highs Investor's Business Daily"
91,11:58AM,U.S. Stocks Edge Higher After the S&P 500s Record Close Barrons.com
92,11:35AM,"US STOCKS-S&P 500, Nasdaq hit record highs as Apple tops $2 trillion in market value Reuters"
93,11:09AM,Lowes Stock Is Rising After Earnings Easily Clear the Bar. Look Out Home Depot. Barrons.com
94,11:00AM,Lowe's Launches Tool Rental Program Nationwide PR Newswire
95,10:47AM,"Stocks move modestly higher, S&P 500 clinches new intraday high MarketWatch"
96,10:15AM,"US STOCKS-S&P 500 notches record high for second day after Target, Lowe's results beat Reuters"
97,09:59AM,"Dow Jones Today, Stocks Mixed; Target Heads Retail Rally; Biotechs Momenta, Gilead, BioMarin Swing Wild On Merger, FDA News Investor's Business Daily"
98,09:34AM,Lowe's Tops Q2 Earnings Forecasts as Online Sales Surge TheStreet.com
99,09:33AM,Stock market opens Wednesday trade flat a day after S&P 500 puts first closing record since February in the books MarketWatch
