,0,1
0,Oct-08-20 12:34PM,Shark Tank star Daymond John: We should be building businesses Yahoo Finance
1,12:15PM,Pepsi Has a Shot at Another Big Sales Year Motley Fool
2,10:41AM,Daymond John partners with Chase for Business to create the first Black Entrepreneurs Day Yahoo Finance Video
3,09:00AM,"SodaStream Announces The Launch Of bubly drops, The First North America Partnership Since Joining PepsiCo PR Newswire"
4,Oct-06-20 12:44PM,Zacks Investment Ideas feature highlights: PepsiCo and Coca-Cola Zacks
5,Oct-05-20 05:51PM,Coke Vs. Pepsi: Has COVID Changed The Odds? Zacks
6,02:46PM,COVID-19 pandemic still influencing how people shop for food: Conagra CEO Yahoo Finance
7,12:19PM,"PepsiCo, Inc. -- Moody's rates PepsiCo notes A1; outlook stable Moody's"
8,11:26AM,[video]4 Super Bowl Ads That Impacted Stock Prices TheStreet.com
9,10:26AM,Coca-Cola dropping some products from its lineup Yahoo Finance Video
10,07:00AM,"Set, miss, repeat big brands and plastic recycling targets Reuters"
11,06:37AM,3 Top Dividend Stocks to Buy in October Motley Fool
12,06:35AM,Corona Hard Seltzer maker takes aim at White Claw's dominance Yahoo Finance
13,06:12AM,Don't Let the Negative Headlines Blind You to Positive Price Action TheStreet.com
14,Oct-03-20 10:43AM,Trumps Positive Covid Test Added a New Wrinkle for the Stock Market. Why It Can Keep Heading Higher. CoinDesk
15,10:43AM,Trumps Positive Covid Test Added a New Wrinkle for the Stock Market. Why It Can Keep Heading Higher. Barrons.com
16,Oct-02-20 06:47PM,"PepsiCo: Despite Solid Q3 Results, This Analyst Remains Sidelined TipRanks"
17,11:24AM,Pepsi Versus Coke: The Cola Wars Are Back Benzinga
18,11:02AM,Price Over Earnings Overview: PepsiCo Benzinga
19,09:50AM,"Company News for Oct 2, 2020 Zacks"
20,07:32AM,A Look Into PepsiCo's Debt Benzinga
21,Oct-01-20 05:48PM,New York City Under Pressure; CDC Funds Stalled: Virus Update Bloomberg
22,04:44PM,Stock Market Today With Jim Cramer: Ford Needs Change TheStreet.com
23,02:37PM,PepsiCo Is Sailing on Its Snacks Distribution Strength Motley Fool
24,01:00PM,PepsiCo Inc (PEP) Q3 2020 Earnings Call Transcript Motley Fool
25,12:48PM,PepsiCo's new macaroni and cheese is 'flying off the shelf': CFO Yahoo Finance
26,12:28PM,"PepsiCo Q3 Revenue Grows Over 5% to $18.09 Billion, Forecasts Solid 2020 Earnings; Target Price $155 FX Empire"
27,12:14PM,"Jobs Again, Consumer Sentiment, Health Honcho on the Hill: 3 Things to Watch Investing.com"
28,12:03PM,"PepsiCo, Conagra, Constellation Brands beat on earnings Yahoo Finance Video"
29,11:53AM,PepsiCo Beats Q3 Estimates: What Investors Need To Know Benzinga
30,10:30AM,PepsiCo Reports a Solid Quarter and I'm Keeping My Long Position TheStreet.com
31,10:27AM,"Pepisco CFO on Q3 earnings beat, innovation, global recovery Yahoo Finance Video"
32,10:22AM,PepsiCo To Beat Annual Profit Bets As Pandemic Fuels Demand For Snacks SmarterAnalyst
33,09:59AM,Another 837K Americans filed for unemployment benefits Yahoo Finance Video
34,09:46AM,"PepsiCo Beats Q3 Earnings Forecast, Boosts Full-Year Guidance, As Snack Sales Continue Lead Revenue Growth TheStreet.com"
35,08:54AM,US STOCKS-Stimulus hopes set to lift Wall St as jobless claims stay elevated Reuters
36,08:47AM,PepsiCo Bounces Right Back to Sales Growth Motley Fool
37,07:30AM,PepsiCo (PEP) Q3 Earnings and Revenues Top Estimates Zacks
38,07:08AM,PepsiCo: Q3 Earnings Insights Benzinga
39,06:30AM,"PepsiCo sees strong annual profit as snacks, sodas thrive in pandemic Reuters"
40,06:16AM,PepsiCo shares pop premarket after company blows past Q3 estimates MarketWatch
41,03:32AM,Watch Now: Here's Whats Moving Markets - October 1 (Video) Investing.com
42,02:34AM,"Stimulus Hopes, Jobless Claims and Bank Stocks - What's up in Markets on Thursday Investing.com"
43,Sep-30-20 12:45PM,How PepsiCo Can Finally Break Out to New Highs on Earnings TheStreet.com
44,10:07AM,PepsiCo's Earnings: A Preview Benzinga
45,Sep-29-20 12:15PM,3 Things You'll Want to Know When PepsiCo Announces Earnings Motley Fool
46,11:37AM,The Pepsi Challenge: How to Trade the Stock Into Earnings TheStreet.com
47,09:14AM,PepsiCo (PEP) Locks Distribution Deal for evian in Canada Zacks
48,07:05AM,3 Coronavirus-Proof Dividend Aristocrats Motley Fool
49,01:49AM,"PepsiCo Q3 EPS to be $1.50, Organic Sales to Grow 2.4%: Morgan Stanley FX Empire"
50,Sep-28-20 10:12PM,25 Most Obese Countries In the World Insider Monkey
51,03:28PM,PepsiCo Wins Exclusive Canadian Distributorship for Evian Spring Water Motley Fool
52,11:45AM,"Alibaba, PepsiCo, Micron, Chevron, and Other Stocks to Watch This Week Barrons.com"
53,10:23AM,Unusual Options Activity Insight: PepsiCo Benzinga
54,10:01AM,PepsiCo (PEP) to Report Q3 Earnings: Will It Beat Estimates? Zacks
55,10:00AM,PepsiCo® Beverages Canada and Danone Waters of America Sign Distribution Agreement for evian® in Canada CNW Group
56,07:35AM,3 Things to Watch in the Stock Market This Week Motley Fool
57,06:16AM,"JPMorgan Chase, Citigroup, PepsiCo and Micron Technology are part of Zacks Earnings Preview Zacks"
58,Sep-27-20 01:18PM,"September jobs report, first presidential debate: What to know in the week ahead Yahoo Finance"
59,Sep-25-20 04:32PM,Stock Market Today 9/25/20: Stocks Win the Session but Lose the Week on Growth Fears Kiplinger
60,12:42PM,"Kiplinger's Weekly Earnings Calendar (9/28-10/2): BBBY, PEP Kiplinger"
61,08:45AM,PepsiCo Earnings: What to Watch Motley Fool
62,Sep-24-20 12:03PM,PepsiCo Could Hang Tough on the Charts TheStreet.com
63,Sep-23-20 05:45PM,PepsiCo (PEP) Stock Moves -0.87%: What You Should Know Zacks
64,06:00AM,Ethical business practices shouldnt be a marketing ploy: Jessica Alba Yahoo Finance Video
65,Sep-22-20 10:00AM,Vail Resorts and PepsiCo Expand Partnership to Advance Sustainability Goals PR Newswire
66,09:00AM,"Stacy's Rise Project Expands Commitment to Female Founders; Partners with Hello Alice to Fund $150,000 in Grants to Black Women Business Owners PR Newswire"
67,08:34AM,Beverage Makers in Spotlight as Consumers Sip On Health Drinks Zacks
68,Sep-21-20 01:56PM,PepsiCo aims to source renewable electricity across all company-owned and controlled operations by 2030 MarketWatch
69,11:11AM,Pepsi Targets 2040 for 100% Renewable Energy TheStreet.com
70,06:00AM,PepsiCo Targets 100% Renewable Electricity Globally PR Newswire
71,Sep-18-20 04:27PM,Central American Bottling Corp. (The) -- Moody's announces completion of a periodic review of ratings of Central American Bottling Corp. (The) Moody's
72,Sep-17-20 07:00AM,9 Consumer Staples Stocks That Can Keep Growing After Covid Is Gone Barrons.com
73,Sep-16-20 05:50PM,PepsiCo (PEP) Dips More Than Broader Markets: What You Should Know Zacks
74,11:31AM,Kraft Heinz CEO: Warren Buffett's top two lieutenants on our board liked our $3.2 billion deal Yahoo Finance
75,Sep-15-20 04:30PM,Pepsi Launches A Sleep Beverage: What You Need To Know About Driftwell Benzinga
76,10:25AM,PepsiCo launches relaxation drink to induce sleep Yahoo Finance Video
77,09:37AM,"PepsiCo (PEP) Explores Functional Drinks, To Launch Driftwell Zacks"
78,09:00AM,Red Lobster® and PepsiCo Kick Off New Relationship with the DEW® Garita - the First Official MTN DEW® Cocktail PR Newswire
79,01:12AM,Bollywood Star Amitabh Bachchan Is the New Voice of Amazons Alexa Bloomberg
80,Sep-14-20 03:31PM,10 Largest Beverage Companies Investopedia
81,03:28PM,How PepsiCo Plans to Fight Coronavirus Insomnia Motley Fool
82,01:20PM,A New Pepsi Challenge: Relaxation Beverage Driftwell TheStreet.com
83,12:04PM,Kroger CEO: COVID-19 pandemic has changed how we shop for food Yahoo Finance
84,10:47AM,Pepsi to launch sleep-aid drink Driftwell as beverage companies expand into new health and wellness categories MarketWatch
85,09:54AM,Soft Drink Stocks May Be About to Regain Their Fizz Investopedia
86,09:00AM,Smiles for Miles of Aisles: Millions of Smiles Return to Stores via Lay's® Potato Chip Bags Benefiting Operation Smile PR Newswire
87,08:30AM,PepsiCo Announces Senior Leadership Appointment PR Newswire
88,Sep-10-20 09:52AM,Kellogg CEO on managing a 114-year-old cereal giant through COVID-19 Yahoo Finance
89,06:00AM,Yahoo Finance Presents: Kellogg CEO Steve Cahillane Yahoo Finance Video
90,Sep-09-20 05:50PM,PepsiCo (PEP) Gains But Lags Market: What You Should Know Zacks
91,09:00AM,"PepsiCo, USAID Launch Five-Year, $20 Million Partnership to Empower Women in Agriculture PR Newswire"
92,06:30AM,Why a $7B Fund Is Holding On to Disney and Alphabet Stock Barrons.com
93,Sep-08-20 11:46AM,"Hedge Funds Arent Crazy About PepsiCo, Inc. (PEP) Anymore Insider Monkey"
94,08:29AM,3 Top Food Stocks to Buy in September Motley Fool
95,Sep-05-20 08:30AM,3 Dividend Stocks That Pay You More Than Pepsi Does Motley Fool
96,Sep-04-20 09:04AM,ROCE Insights For PepsiCo Benzinga
97,Sep-03-20 10:00AM,"Frito-Lay Headlines Return To NFL Kickoff With Star-Studded Commercial Featuring Tom Brady, Ezekiel Elliott, Rob Gronkowski, Dak Prescott And Many More PR Newswire"
98,Sep-01-20 08:00AM,Frito-Lay and Feed the Children Supplement a Quarter-Million Meals for Students in Underserved Communities this Fall PR Newswire
99,Aug-31-20 05:45PM,PepsiCo (PEP) Gains As Market Dips: What You Should Know Zacks
