,0,1
0,Oct-09-20 07:36AM,Ecolab Introduces New Automated Precision Dispensing System Zacks
1,Oct-08-20 11:30AM,Pacific Biosciences Unveils Sequel IIe for HiFi Sequencing Zacks
2,10:17AM,Masimo Unveils New Wearable Wireless Continuous Thermometer Zacks
3,08:44AM,"Medtronic Announces U.S. Launch of Adaptix, Expands Portfolio Zacks"
4,Oct-07-20 12:51PM,"The Zacks Analyst Blog Highlights: Zoom Video, salesforce, Thermo Fisher, FedEx and Square Zacks"
5,12:11PM,"Jabil, Harley-Davidson, TMO, LHCG and NovoCure as Zacks Bull and Bear of the Day Zacks"
6,11:20AM,Walgreens' Pharmacy International Arm Faces Coronavirus Woes Zacks
7,08:22AM,FDA Amends Hologic's Aptima's EUA for Asymptomatic Testing Zacks
8,07:56AM,Ecolab Disinfectant Gets EPA Nod for Use Against SARS-CoV-2 Zacks
9,Oct-06-20 05:45PM,Thermo Fisher Scientific (TMO) Stock Moves -1.06%: What You Should Know Zacks
10,01:01PM,BofA Likes Qiagen After Thermo Fisher Deal Fails To Get Shareholder Approval Benzinga
11,11:33AM,Coronavirus Drives Testing Stocks: Is There Room for More Upside? Zacks
12,10:27AM,Here's Why You Should Add Globus Medical to Your Portfolio Zacks
13,10:18AM,Ecolab Launches Sanitizer to Prevent Food-Borne Illness Zacks
14,09:14AM,Here's Why You Should Retain Fresenius Medical Stock Now Zacks
15,09:12AM,BD Gets 510(k) Clearance for Its FACSLyric Flow Cytometer Zacks
16,07:34AM,3 Stocks You Can Keep Forever Motley Fool
17,Oct-05-20 08:00AM,"Thermo Fisher Scientific to Hold Earnings Conference Call on Wednesday, October 21, 2020 PR Newswire"
18,Oct-02-20 01:45PM,Dont Count Out Inovio Pharmaceuticals Stock Just Yet InvestorPlace
19,12:10PM,Why Thermo Fisher (TMO) Could Beat Earnings Estimates Again Zacks
20,09:57AM,"Zacks.com featured highlights include: Thor Industries, Thermo Fisher Scientific, Big Lots, Sapiens International and Fortune Brands Home & Security Zacks"
21,06:28AM,8 Costly Investing Mistakes That Could Ruin You Kiplinger
22,Oct-01-20 09:15AM,Thermo Fisher (TMO) Hits Fresh High: Is There Still Room to Run? Zacks
23,Sep-30-20 11:06AM,"Thermo Fisher Rides on End Market Growth, Test Revenues Zacks"
24,09:41AM,"Nike, OrganiGram, Thermo Fisher, Danaher Corp and Agilent Tech highlighted as Zacks Bull and Bear of the Day Zacks"
25,09:35AM,"Benzinga's Top Upgrades, Downgrades For September 30, 2020 Benzinga"
26,Sep-29-20 06:20AM,"The Zacks Analyst Blog Highlights: Procter & Gamble, Verizon, Thermo Fisher Scientific, Nvidia and Nike Zacks"
27,Sep-28-20 05:45PM,Thermo Fisher Scientific (TMO) Gains But Lags Market: What You Should Know Zacks
28,02:05PM,"Top Analyst Reports for P&G, Verizon & Thermo Fisher Zacks"
29,10:25AM,Inovio Shares Plunge After FDA Puts Partial Hold On Coronavirus Vaccine Trial TheStreet.com
30,Sep-25-20 11:30AM,Is Thermo Fisher Scientific (TMO) Outperforming Other Medical Stocks This Year? Zacks
31,08:00AM,You Can Beat The Market Without Owning FAANG Stocks Investor's Business Daily
32,Sep-24-20 09:20AM,LabCorp Boosts Oncology Offerings With Resolution ctDx Launch Zacks
33,Sep-23-20 11:18AM,This Week's Asset Class Flows: 09/22/2020 ETF Database
34,Sep-22-20 05:45PM,Thermo Fisher Scientific (TMO) Outpaces Stock Market Gains: What You Should Know Zacks
35,Sep-21-20 01:42PM,"The Zacks Analyst Blog Highlights: FMS, HOLX and TMO Zacks"
36,Sep-18-20 09:56AM,3 MedTech Outperformers to Grab Amid September Pullback Zacks
37,08:00AM,"Top Fund Avoids Fads, Sticks To Leaders Like Apple Investor's Business Daily"
38,Sep-17-20 09:15AM,Thermo Fisher Expands Lab Plastic Making for Coronavirus Support Zacks
39,Sep-16-20 05:45PM,Thermo Fisher Scientific (TMO) Stock Moves -0.28%: What You Should Know Zacks
40,Sep-15-20 08:00PM,The Argus Dividend Growth Portfolio Argus Research
41,03:30PM,IBD 50 Stocks To Watch: Coronavirus Test Kit Maker Has New Buying Opportunity Investor's Business Daily
42,01:05PM,Are Thermo Fisher Scientific Inc. (NYSE:TMO) Investors Paying Above The Intrinsic Value? Simply Wall St.
43,10:01AM,Cardiovascular Systems Rides on Launches Amid Coronavirus Woes Zacks
44,08:00AM,"Thermo Fisher Scientific Further Expands Laboratory Plastics Production to Support COVID-19 Testing, Therapies and Vaccines PR Newswire"
45,07:21AM,What's Fueling Growth at Thermo Fisher Scientific? Motley Fool
46,Sep-14-20 09:41AM,"The Zacks Analyst Blog Highlights: Quest Diagnostics, Abbott, Quidel, QIAGEN and Thermo Fisher Scientific Zacks"
47,08:00AM,"Thermo Fisher Scientific to Present at the Morgan Stanley Global Healthcare Conference on September 15, 2020 PR Newswire"
48,Sep-11-20 01:11PM,"CHDN, AMC, FMS, OMI and TMO as Zacks Bull and Bear of the Day Zacks"
49,09:15AM,Thermo Fisher Scientific's Debt Overview Benzinga
50,Sep-10-20 05:45PM,Thermo Fisher Scientific (TMO) Gains As Market Dips: What You Should Know Zacks
51,Sep-09-20 11:43AM,Why Inovio Pharmaceuticals Stock Is Jumping Today Motley Fool
52,11:30AM,Is Thermo Fisher Scientific (TMO) Stock Outpacing Its Medical Peers This Year? Zacks
53,08:32AM,HealthEquity (HQY) Q2 Earnings and Revenues Beat Estimates Zacks
54,08:08AM,Moody's US healthcare risk heat map - Overall outlook improves as patients return and COVID testing accelerates Moody's
55,Sep-08-20 04:25PM,Inovio Adds Thermo Fisher As A Coronavirus Vaccine Manufacturing Partner Investor's Business Daily
56,09:36AM,Inovio Announces Covid-19 Vaccine Deal With Thermo Fisher TheStreet.com
57,08:27AM,Shares of Inovio rise 6% on vaccine manufacturing deal with Thermo Fisher MarketWatch
58,Sep-07-20 08:00PM,Weekly Stock List Argus Research
59,Sep-04-20 07:29AM,Cooper Companies (COO) Q3 Earnings & Revenues Top Estimates Zacks
60,Sep-03-20 09:08AM,Aurora Cannabis (ACB) to Post Q4 Earnings: What's in Store? Zacks
61,09:06AM,"Patterson Companies (PDCO) Q1 Earnings Top Estimates, Up Y/Y Zacks"
62,Sep-02-20 08:33AM,Is Thermo Fisher (TMO) a Great Growth Stock? Zacks
63,Sep-01-20 07:20AM,What's in Store for Patterson Companies' (PDCO) Q1 Earnings? Zacks
64,Aug-31-20 03:01PM,Cooper Companies (COO) to Post Q3 Earnings: What's in Store? Zacks
65,Aug-28-20 02:46PM,Should I Avoid Thermo Fisher Scientific Inc. (TMO)? Insider Monkey
66,11:56AM,Edited Transcript of TMO.N earnings conference call or presentation 24-Apr-19 12:30pm GMT Thomson Reuters StreetEvents
67,11:43AM,Abbott Shares Climb as U.S. Buys Out Supply of New Covid-19 Test Barrons.com
68,08:26AM,Veeva Systems (VEEV) Q2 Earnings and Revenues Beat Estimates Zacks
69,Aug-27-20 08:00AM,Thermo Fisher Scientific to Host Virtual Analyst Meeting PR Newswire
70,Aug-25-20 01:59PM,5 Companies Reach 52-Week Highs GuruFocus.com
71,01:24PM,"Top Stock Reports for JNJ, Procter & Gamble & Thermo Fisher Zacks"
72,Aug-24-20 12:40PM,"The Zacks Analyst Blog Highlights: QIAGEN, Merit Medical, OPKO, Abbott and Abiomed Zacks"
73,11:30AM,Has Thermo Fisher Scientific (TMO) Outpaced Other Medical Stocks This Year? Zacks
74,07:37AM,Thermo Fisher Unveils Suite of Hematology-Oncology Solutions Zacks
75,06:57AM,Veeva Systems (VEEV) to Post Q2 Earnings: What's in Store? Zacks
76,Aug-21-20 11:30AM,Thermo Fisher (TMO) Up 2.8% Since Last Earnings Report: Can It Continue? Zacks
77,09:50AM,MedTech Lifts S&P 500 Index: 3 Stocks With Upside Potential Zacks
78,Aug-18-20 10:29AM,Will Thermo Fisher's (TMO) Failed QIAGEN Deal Cost it a Lot? Zacks
79,08:39AM,FDA warns providers about problems with Thermo Fisher's COVID-19 test MarketWatch
80,Aug-15-20 07:16AM,"Buy in Europe, where stocks have been brutally beaten up, says fund manager MarketWatch"
81,Aug-14-20 10:46AM,Myriad Genetics' (MYGN) Q4 Loss Narrower Than Estimated Zacks
82,07:55AM,"Accuray (ARAY) Reports Loss in Q4, Revenues Miss Estimates Zacks"
83,Aug-13-20 01:54PM,HHS invests $6.5 million in diagnostic labs to expand COVID-19 testing Reuters
84,09:39AM,Thermo Fisher Ditches Bid for Qiagen as Offer Falls Short Bloomberg
85,09:13AM,Thermo Fisher Exits Planned $13 Billion Takover Of COVID-19 Testing Group Qiagen TheStreet.com
86,08:06AM,HMS Holdings (HMSY) Loses 2.9% Since Q2 Earnings Release Zacks
87,07:41AM,Thermo Fisher ends deal agreement for genetic testing firm Qiagen Reuters
88,07:33AM,Change Healthcare (CHNG) Gains 1.9% Since Q1 Earnings Beat Zacks
89,07:30AM,"Thermo Fisher Scientific Announces Results of Offer to Acquire QIAGEN, Lapse of Offer and Termination of Acquisition Agreement PR Newswire"
90,Aug-12-20 04:59PM,Thermo Fisher Scientific Supports COVID-19 Testing at Historically Black Colleges and Universities Seeking to Provide a Safe Return to Campus PR Newswire
91,04:47PM,"'Halftime Report' Traders Share Their Thoughts On Monster Beverage, Thermo Fisher And More Benzinga"
92,08:41AM,AMN Healthcare (AMN) Loses 3.3% Despite Q2 Earnings Beat Zacks
93,07:10AM,Glaukos (GKOS) Loses 17.1% Despite Q2 Earnings & Revenues Beat Zacks
94,Aug-11-20 10:14AM,Thermo Fisher to update on Qiagen tender offer on Thursday Reuters
95,09:23AM,Thermo Fisher Scientific Provides Process Overview for the Announcement of Final Offer Results PR Newswire
96,08:10AM,PRA Health (PRAH) Q2 Earnings and Revenues Beat Estimates Zacks
97,Aug-10-20 06:16PM,Andreas Halvorsen's 5 Biggest Trades of the 2nd Quarter GuruFocus.com
98,08:17AM,Surmodics (SRDX) Q3 Earnings and Revenues Beat Estimates Zacks
99,05:43AM,Avanos Medical (AVNS) Q2 Earnings and Revenues Top Estimates Zacks
