,0,1
0,Aug-25-20 06:13PM,This Analyst Sees a Rough Road Ahead for AMD Stock TipRanks
1,04:31PM,Analyzing AMD's Unusual Options Activity Benzinga
2,03:08PM,Top Tech Stocks for September 2020 Investopedia
3,09:00AM,Northland Cuts AMD To Hold Due To Negative Catalysts SmarterAnalyst
4,Aug-24-20 04:50PM,S&P Hits a New High and Markets Close Up on FDA Plasma News Barrons.com
5,12:45PM,1 Big Reason to Choose AMD Stock Over NVIDIA Motley Fool
6,09:34AM,"Benzinga's Top Upgrades, Downgrades For August 24, 2020 Benzinga"
7,Aug-23-20 06:04PM,Intels $10 Billion Buyback Wont Solve Its Biggest Problems Motley Fool
8,08:41AM,Advanced Micro Devices Near All-Time High After Historic Breakout FX Empire
9,Aug-22-20 07:00AM,"A Top Pension Manager Sold GE, Starbucks, and McDonalds Stock. It Bought This Chip Stock. Barrons.com"
10,Aug-21-20 10:53AM,Intel Is a Reasonable Value Play but Faces Threats InvestorPlace
11,10:30AM,Understanding Advanced Micro Devices's Unusual Options Activity Benzinga
12,09:43AM,3 Beaming Stocks to Buy InvestorPlace
13,09:22AM,$10 Billion Reasons to Start Buying Intel Stock Now InvestorPlace
14,09:10AM,"Plagued by Chip Delays, Intel Stock Is Almost Cheap Enough to Buy InvestorPlace"
15,Aug-20-20 10:04AM,"Zacks Earnings Trends Highlights: Texas Instruments, Advanced Micro Devices, Whirlpool and Cognizant Zacks"
16,08:12AM,"Dow Jones Futures Fall After Stock Market Rally Retreat On Fed Concerns; Alibaba, Nvidia Earnings Strong Investor's Business Daily"
17,01:39AM,Intel vs AMD: Which Chip Stock Is A More Compelling Investment? SmarterAnalyst
18,Aug-19-20 05:55PM,"Intel plans big stock buyback after shares plummet, boosting prices in after-hours trading MarketWatch"
19,12:42PM,Apple is now worth $2 trillion here's when it may be worth $3 trillion Yahoo Finance
20,10:14AM,"The Zacks Analyst Blog Highlights: Intel, Advanced Micro Devices, Taiwan Semiconductor Manufacturing, Advanced Energy Industries, Micron Technology and Analog Devices Zacks"
21,10:04AM,Nvidia Reports Earnings Today. Heres What To Expect. Barrons.com
22,Aug-18-20 12:11PM,Is Advanced Micro Devices Stock a Buy? Motley Fool
23,Aug-17-20 01:48PM,IBM tosses hat into AMD's ring with 7-nanometer CPU MarketWatch
24,12:50PM,BofA Cuts Intel Target On Uncertain Roadmap Benzinga
25,11:33AM,IBM Inks Deal With Samsung to Build its Latest Chip Processor Zacks
26,11:19AM,"The Zacks Analyst Blog Highlights: NVIDIA, Zoom Video, Amazon, Advanced Micro Devices and Intel Zacks"
27,07:00AM,"Biggest U.S. Pension Sold Apple Stock. It Bought AMD, Regeneron, and This Marijuana Stock. Barrons.com"
28,Aug-16-20 11:11AM,AMD Could Make Billions More From This Market Going Head-to-Head With Intel Motley Fool
29,Aug-14-20 03:30PM,The 3 Best Dow Jones Stocks to Trade Today InvestorPlace
30,12:19PM,7 Semiconductor Stocks Worth Buying as Technology Accelerates InvestorPlace
31,Aug-13-20 02:03PM,Intel Pushes Back on Concerns About Its Chip-Making Technology Barrons.com
32,Aug-12-20 07:25PM,Why AMD Stock Surged Today Motley Fool +7.45%
33,07:02PM,"S&P 500 Rallies 47 Points on Dem Pick for Vice President, AMD Leads Semiconductor Stocks Higher, Cancelling College Football Looms for Disney Motley Fool"
34,04:04PM,"Tesla, Tech Send Nasdaq Stocks Skyrocketing Motley Fool"
35,01:03PM,Goldman Sachs: The next big investment opportunity Yahoo Finance
36,10:19AM,U.S. Stocks Rise With Bond Yields; Gold Rebounds: Markets Wrap Bloomberg
37,09:48AM,"Dow Jones Today, Stocks Climb After Moderna Vaccine Deal; AMD Leads Chip Bounce; Tesla Announces Stock Split Investor's Business Daily"
38,Aug-11-20 03:48PM,Unusually Large AMD Option Trades Suggest Stock Could Be Headed Even Higher Benzinga -6.52%
39,01:07PM,Analyst: Amazon Web Services Data Shows Huge Gains for AMD Chips Motley Fool
40,Aug-10-20 04:36PM,Dow Jones Rises As This Dow Leader Trades Inside A Key Buy Zone Investor's Business Daily
41,01:55PM,How AMD Can Hit This Analyst's Bull-Case Price Target Of $135 Benzinga
42,Aug-07-20 03:11PM,"Nasdaq Slumps 1.2%, Hurt By Software Sell-Off; Solar Stocks Are Flying Here's Why Investor's Business Daily"
43,10:45AM,"10 Best-Performing Stocks in Nasdaq ETF as Index Tops 11,000 Zacks"
44,10:14AM,"Alibaba, Tencent Among Stocks Hit By US-China Tension; Jobs Number A Step In Right Direction Benzinga"
45,Aug-06-20 11:10AM,Semiconductor ETFs Roaring to New Highs on Solid Earnings Zacks
46,09:54AM,"Zacks Market Edge Highlights: Advanced Micro Devices, Intel, QUALCOMM, NVIDIA and Taiwan Semiconductor Manufacturing Zacks"
47,08:45AM,"Zacks Earnings Trends Highlights: Texas Instruments, Advanced Micro Devices, Whirlpool and Cognizant Zacks"
48,Aug-05-20 05:18PM,Seismic Semi Shifts: QCOM and NVDA Zacks
49,04:02PM,AMD reaches $100 billion market cap after stock rise MarketWatch
50,12:45PM,Which Semiconductor Stocks Should You Buy? Zacks
51,07:36AM,"Parabolic AMD, Agreeing to Agree, Disney's GAAP Earnings Gap: Market Recon TheStreet.com"
52,07:13AM,"Jim Cramer: Buyers, It's Time to Look in the Mirror TheStreet.com"
53,Aug-04-20 08:55PM,Stupidly Bullish: Cramer's 'Mad Money' Recap (Tuesday&nbsp; 8/4/20) TheStreet.com +9.49%
54,08:27PM,AMDs Stock Is Up 80% This Year. Why the Rally Could Keep Going. Barrons.com
55,06:17PM,"S&P 500 News: AMD Stock Surges, Disney Loses Billions, Another CEO Change for Ford Motley Fool"
56,06:12PM,Semiconductor ETFs in Focus as AMD Soars Zacks
57,05:42PM,Stock Upgrades: Maxlinear Inc Shows Rising Relative Strength Investor's Business Daily
58,05:10PM,Semiconductor ETFs in Focus as AMD Soars Zacks
59,04:43PM,Nasdaq Rises 38 Points; AMD Hits Record on a Rival's Beat-Down; Earnings Lift Take-Two Motley Fool
60,04:35PM,Why AMD Stock Surged to a New All-Time High Today Motley Fool
61,04:25PM,"AMD closes just shy of $100-billion market cap, as more analysts see it taking market share from Intel MarketWatch"
62,04:24PM,"Stocks Rally Into The Close; Retail, Semiconductors, Energy Among Leaders Investor's Business Daily"
63,01:38PM,"McDonald's, Exxon Mobil Lead Dow Jones 100-Point Rally; AMD Stock Surges, Leads Nasdaq 100 Investor's Business Daily"
64,12:13PM,New AMD Radeon Pro 5000 Series GPUs Bring Exceptional Graphics Performance to Updated 27-inch iMac GlobeNewswire
65,12:09PM,Jefferies Lifts PT On AMD After Intel Chip Delay SmarterAnalyst
66,12:02PM,PreMarket Prep Stock Of The Day: Advanced Micro Devices Benzinga
67,11:53AM,AMD stock surges to new record on road to $100 billion market cap MarketWatch
68,10:56AM,AMD Rises as Jefferies Say Intel's Delay is AMD's Gain TheStreet.com
69,09:58AM,"Dow Jones Today Dips, Nasdaq Fights To Extend Streak; Take-Two, SolarEdge, AMD Rocket Investor's Business Daily"
70,Aug-03-20 03:48PM,'Halftime Report' Traders Share Their Thoughts On Semiconductor Stocks Benzinga
71,10:18AM,"Selling in Stocks Is Nearly Zero, Causing Market Rally Investopedia"
72,08:20AM,Dow Jones Futures Rise As Coronavirus Stock Market Rally Awaits Stimulus Deal; Microsoft Confirms TikTok Talks Investor's Business Daily
73,Aug-02-20 06:53PM,10 US Companies With Highest Revenue Exposure To China Insider Monkey
74,Jul-31-20 04:02PM,"Stock Market Rally Shows Bullish Action; Apple, Amazon, Facebook, AMD, Shopify Are Earnings Winners Investor's Business Daily"
75,02:16PM,Why Nvidia Shares Will Top $500 InvestorPlace
76,01:03PM,"Nvidia Stock Continues Its March, But Can Growth Continue? InvestorPlace"
77,11:58AM,Nvidia in Advanced Talks to Buy SoftBanks Chip Company Arm Bloomberg
78,08:00AM,9 Of July's Top 10 Stocks Aren't In Technology Investor's Business Daily
79,Jul-30-20 10:51AM,Semiconductor Short Sellers Take $800M Hit From AMD Earnings Beat Benzinga
80,09:35AM,Semiconductor ETF (SMH) Hits New 52-Week High Zacks
81,09:00AM,AMD Commemorates 25 Years of Corporate Responsibility Reporting GlobeNewswire
82,08:49AM,"Results: Advanced Micro Devices, Inc. Exceeded Expectations And The Consensus Has Updated Its Estimates Simply Wall St."
83,Jul-29-20 06:21PM,Why AMD Stock Soared to a New All-Time High Today Motley Fool +12.54%
84,05:34PM,Release the Ryzen! AMD Roars in the Nanometer Wars Zacks
85,04:34PM,S&P 500 Rallies as AMD and L Brands Stocks Soar Motley Fool
86,01:30PM,"5 Stock Gainers on Wednesday: Kodak, L Brands, AMD TheStreet.com"
87,01:09PM,"AMD Analysts Bet On Continuing Momentum Amid Tailwinds, Execution, Intel Missteps Benzinga"
88,01:08PM,AMD Jumps After Strong Q2 Results and Analyst Comments Investopedia
89,11:11AM,"AMD Q2 Earnings Beat Estimates, Shares Up on Strong Guidance Zacks"
90,11:04AM,Looking Into Advanced Micro Devices's Return On Capital Employed Benzinga
91,10:17AM,Upbeat earnings lift Wall Street as focus shifts to Fed Reuters
92,10:10AM,"Dow Jones Today, Stocks Advance Ahead Of Fed; AMD, Starbucks Soar On Earnings: Boeing Loss Misses Target Investor's Business Daily"
93,09:44AM,AMD stock surges to record after outlook contrasts with Intels faceplant MarketWatch
94,08:14AM,"Dow Jones Futures Signal Modest Gains Ahead Of Fed Rate Decision; Boeing Reports Earnings, While AMD Surges 11% Investor's Business Daily"
95,07:50AM,AMD stock upgraded at Susquehanna after earnings MarketWatch
96,07:33AM,"General Electric, AMD, Boeing - 5 Things You Must Know Wednesday TheStreet.com"
97,04:06AM,"AMD Reassures On Its Chip, GPU Production Amid Intel Delays SmarterAnalyst"
98,02:26AM,"AMD Gains 10% In After-Hours on 2Q Earnings Beat, Upbeat Guidance SmarterAnalyst"
99,01:01AM,Advanced Micro Devices (AMD) Q2 2020 Earnings Call Transcript Motley Fool
