,0,1
0,Sep-28-20 11:10PM,Global Deaths Reach 1 Million; New Poor Emerge : Virus Update Bloomberg
1,04:20PM,Abbott Labs Gets European Approval For Newest Version Of Its Glucose Monitoring System Investor's Business Daily
2,04:07PM,Trump says 150 million Abbott rapid coronavirus tests will be distributed in 'the coming weeks' MarketWatch
3,02:18PM,"Under pressure over virus, Trump to announce more tests for states Reuters"
4,11:23AM,Abbott Labs Gets European Approval For Newest Version Of Its Glucose Monitoring System Investor's Business Daily
5,09:01AM,Abbott wins EU approval for smallest version of glucose monitoring device Reuters
6,09:00AM,"Abbott's FreeStyle® Libre 3 System Receives CE Mark - Features World's Smallest, Thinnest Sensor with Best-in-Class Performance at the Same Low Cost for People with Diabetes PR Newswire"
7,Sep-27-20 06:04AM,A Second Wave of Coronavirus Could Be Coming: 3 Stocks to Buy Before It Hits Motley Fool
8,Sep-25-20 11:13AM,Abbott Labs Stock Could Still Slip Lower TheStreet.com
9,10:00AM,Is JNJ Stock A Buy As Pharma Giant Starts Final-Phase Coronavirus Vaccine Trials? Investor's Business Daily
10,06:03AM,3 Dividend Aristocrats to Buy and Hold Forever Motley Fool
11,Sep-24-20 07:01PM,Jim Cramer: Abbott's Rapid Covid-19 Test and My Super Bowl Dreams TheStreet.com
12,10:30AM,Abbott's MitraClip G4 Receives CE Mark for Treatment of MR Zacks
13,07:05AM,Everything Investors Need to Know About Coronavirus Tests Motley Fool
14,Sep-23-20 05:45PM,Abbott (ABT) Stock Moves -1.98%: What You Should Know Zacks
15,06:12AM,3 Safe Coronavirus Stocks to Buy Ahead of a Market Crash Motley Fool
16,02:00AM,FOCUS-Positive about flying? Airlines look to COVID tests that give results in minutes Reuters
17,Sep-22-20 05:30PM,Abbott Wins European Approval for Latest MitraClip Heart Valve Device Motley Fool
18,04:32PM,Lufthansa plans rapid COVID-19 testing starting October -executive Reuters
19,08:51AM,4 Best Diabetes Device Stocks to Focus on Amid Coronavirus Crisis Zacks
20,07:15AM,Abbott Tacks On Massive Coronavirus Test Growth But Is ABT Stock A Buy? Investor's Business Daily
21,Sep-21-20 10:24AM,"Abbott Launches Sports Biosensor in Europe, Boosts CGM Wing Zacks"
22,09:02AM,Abbott Receives CE Mark for Next-Generation MitraClip Heart Valve Repair Device to Treat Mitral Regurgitation PR Newswire
23,09:00AM,Abbott Hosts Conference Call for Third-Quarter Earnings PR Newswire
24,Sep-18-20 09:26AM,Is Sorrento Stock Really Worth the Speculation? InvestorPlace
25,06:10AM,3 Dividend Stocks Perfect for Retirees Motley Fool
26,05:31AM,20/20 GeneSystems Stock: Leveraging AI for More Accurate Cancer Screening InvestorPlace
27,Sep-17-20 09:58PM,Abbott Launches World's First Glucose Monitor for Athletes Motley Fool
28,05:45PM,Abbott (ABT) Gains As Market Dips: What You Should Know Zacks
29,11:39AM,Abbott Declares 387th Consecutive Quarterly Dividend PR Newswire
30,09:00AM,"Abbott Introduces Libre Sense Glucose Sport Biosensor in Europe, World's First Glucose Biosensor Designed for Athletes PR Newswire"
31,07:00AM,"RPT-FOCUS-U.S. plans for hundreds of millions of cheap, fast COVID-19 tests Reuters"
32,Sep-15-20 08:00PM,The Argus Dividend Growth Portfolio Argus Research
33,Sep-14-20 09:41AM,"The Zacks Analyst Blog Highlights: Quest Diagnostics, Abbott, Quidel, QIAGEN and Thermo Fisher Scientific Zacks"
34,Sep-13-20 08:00PM,Weekly Stock List Argus Research
35,08:25AM,Calculating The Fair Value Of Abbott Laboratories (NYSE:ABT) Simply Wall St.
36,06:08AM,3 Rock-Solid Dividend Stocks That You Can Buy and Hold Forever Motley Fool
37,Sep-11-20 08:26PM,Dividend Aristocrat AbbVie Declares Its Latest Payout; Yield Is 5.3% Motley Fool
38,05:45PM,Abbott (ABT) Outpaces Stock Market Gains: What You Should Know Zacks
39,Sep-10-20 10:58AM,Quest Diagnostics (DGX) Could Enter New Downtrend Investopedia
40,Sep-09-20 03:21PM,"Consumer goods drive record in seaborne imports to U.S. in August, and medical test kits may have peaked, report finds MarketWatch"
41,11:08AM,"Abbott Banks on EPD, Nutrition Growth to Beat Coronavirus Woes Zacks"
42,10:08AM,Why Shares of These 3 Coronavirus-Test Makers Saw Big Moves in August Motley Fool
43,08:08AM,Moody's US healthcare risk heat map - Overall outlook improves as patients return and COVID testing accelerates Moody's
44,06:30AM,Why a $7B Fund Is Holding On to Disney and Alphabet Stock Barrons.com
45,Sep-08-20 03:58PM,Why These 3 Coronavirus-Related Stocks Plummeted More Than 35% in August Motley Fool
46,Sep-07-20 11:39AM,"REFILE-From Target to Twitter, U.S. companies urge workers to vote Reuters"
47,08:53AM,Abbott Begins BTK Clinical Trial to Evaluate DRS Therapy Zacks
48,Sep-06-20 08:30AM,Is Abbott Laboratories Stock a Buy? Motley Fool
49,07:10AM,3 Top Coronavirus Stocks to Buy in September Motley Fool
50,Sep-05-20 09:34AM,4 Strategies for Investing During the Coronavirus Pandemic Motley Fool
51,Sep-04-20 05:45PM,Abbott (ABT) Dips More Than Broader Markets: What You Should Know Zacks
52,12:06PM,"Quick Virus Testing, Traffic Trends, Bring Hope for Airlines Barrons.com"
53,09:23AM,"The Zacks Analyst Blog Highlights: Medtronic, Abbott Laboratories, Myriad Genetics, Zimmer Biomet and General Electric Zacks"
54,09:15AM,"Next Coronavirus Market Crash: Where to Invest $1,000 Motley Fool"
55,Sep-03-20 09:27AM,Medicare Coverage for Libre 2 Boosts Abbott's CGM Prospects Zacks
56,09:00AM,Abbott Announces Start of Trial to Evaluate the New Esprit BTK Drug-Eluting Resorbable Scaffold PR Newswire
57,Sep-02-20 09:25PM,Fulgent Shares Up 10% On COVID-19 Testing Deal For New York Schools Benzinga
58,07:03PM,"Abbot Labs: New COVID-19 Antibody Test Is a Game Changer, Says Analyst TipRanks"
59,04:13PM,"'Halftime Report' Traders Weigh In On DraftKings, Beyond Meat And More Benzinga"
60,04:02PM,Why Co-Diagnostics Shares Sank Today While the Stock Market Jumped Motley Fool
61,09:53AM,Roche Stock Is Rising Because the Company Has a Covid-19 Antigen Test Barrons.com
62,Sep-01-20 09:34PM,"Trump administration sending rapid COVID tests to states, CDC bars evictions Reuters"
63,06:43PM,Analyst Report: Abbott Laboratories Morningstar Research
64,01:47PM,Heres what to know about Abbotts 15-minute COVID-19 test MarketWatch
65,12:30PM,"In Canada, airlines face uphill climb to replace quarantines with COVID-19 testing Reuters"
66,12:29PM,"U.S. to send millions of rapid COVID-19 tests to states to support school reopening, other tasks Reuters"
67,09:42AM,Why Abbott Stock Is Up Motley Fool
68,09:00AM,Abbott's FreeStyle® Libre 2 iCGM System Now Available to Medicare Beneficiaries PR Newswire
69,Aug-31-20 01:34PM,"The Zacks Analyst Blog Highlights: Verizon Communications, Novartis, Abbott Laboratories, AT&T, Intuitive Surgical and Northrop Grumman Zacks"
70,12:33PM,"The Zacks Analyst Blog Highlights: Abbott Lab, Quidel, Becton, Dickinson and Company, Hologic and Quest Diagnostics Zacks"
71,11:34AM,Coronavirus Impact on Consumer Behavior Zacks
72,11:21AM,Abbott Analyst: Expert View On Rapid Coronavirus Antigen Test 'Clearly Bullish' Benzinga
73,Aug-30-20 09:06AM,Better Coronavirus Stock: Gilead Sciences or Abbott Laboratories? Motley Fool
74,03:24AM,Abbott Expanding Its Covid-19 Test To Asymptomatic People- Report SmarterAnalyst
75,Aug-28-20 08:32PM,Markets Rise on Covid Hopes. But Just Ahead Is a Treacherous Fall. Barrons.com
76,05:45PM,Abbott (ABT) Stock Sinks As Market Gains: What You Should Know Zacks
77,05:10PM,"Apple Removes All Epic Games From App Store, Terminates Dev Account Barrons.com"
78,03:29PM,Waiting for COVID-19 testing results is 'still too long': Doctor Yahoo Finance Video
79,03:05PM,"Top Stock Reports for Verizon, Novartis & Abbott Zacks"
80,03:00PM,Hedge Funds Never Been This Bullish On Abbott Laboratories (ABT) Insider Monkey
81,01:51PM,Jim Cramer: Abbott Labs and the Rally in Travel TheStreet.com
82,01:05PM,Abbott Laboratories Meets 80-Plus Relative Strength Rating Benchmark Investor's Business Daily
83,11:43AM,Abbott Shares Climb as U.S. Buys Out Supply of New Covid-19 Test Barrons.com
84,08:26AM,"The Daily Biotech Pulse: Moderna Japanese Vaccine Deal Talk, Lipocine FDA Decision, Liver Congress Presentations Benzinga"
85,05:16AM,XpresSpa Groups Stock Drop Ignores the Potential of Pivot to Virus Testing InvestorPlace
86,01:53AM,Abbott Scores $760M US Gov Deal For Rapid Covid-19 Saliva Test SmarterAnalyst
87,Aug-27-20 11:01PM,"GLOBAL MARKETS-Treasury yields, dollar gain after Fed's historic policy shift Reuters +7.85%"
88,10:56PM,Trump administration to purchase 150 million Abbott COVID-19 tests for $750 million Reuters
89,07:51PM,"GLOBAL MARKETS-Asian stocks may be choppy despite U.S. Fed inflation shift, COVID outlook Reuters"
90,07:29PM,U.S. Buys Almost All Abbotts $5 Rapid Tests Made This Year Bloomberg
91,07:22PM,Why Abbott Laboratories Stock Surged Today Motley Fool
92,07:01PM,Jim Cramer: Here Comes the Biggest Test Yet TheStreet.com
93,06:41PM,Why a New COVID-19 Test Is Giving Shake Shack and Other Restaurants a Big Boost Motley Fool
94,06:26PM,"U.S. Deaths Top 180,000; Abbott Jumps on Fast Test: Virus Update Bloomberg"
95,06:19PM,Why Fluidigm Stock Plunged Today Motley Fool
96,05:58PM,"S&P 500 Airline Stocks, Cruise Stocks Surge on Abbott Labs FDA Approval, Federal Reserve Policy Change Motley Fool"
97,05:25PM,'This is really a game changer': Dr. Soren Christiansen on Abbott's rapid coronavirus test Yahoo Finance Video
98,05:00PM,New CDC Covid Testing Guidelines Have It Backward Bloomberg
99,04:49PM,Dow and S&P Close Higher on Rapid Virus Test News Barrons.com
