,0,1
0,Sep-28-20 09:22PM,4 Underrated Tech Stocks Motley Fool
1,08:10PM,"Microsoft Says Office 365, Teams, Other Online Services Down Bloomberg"
2,06:14PM,Google to Collect 30% Cut on In-App Purchases Starting in 2021 TheStreet.com
3,05:27PM,"Google-Owner Alphabet Bares Fangs, Clawing Back From Coronavirus Market Crash Investor's Business Daily"
4,04:52PM,"Alphabet Inc. Cl A stock rises Monday, still underperforms market MarketWatch"
5,04:21PM,Palantir eyes $22B market debut here's what the secretive big-data firm does Yahoo Finance
6,02:30PM,Google Tries to Find an App Store Fix After Fortnite Rift Bloomberg
7,01:35PM,Study says Google market power has grown despite EU order to play fair Reuters
8,01:30PM,Marketing Beer During a Pandemic Isn't Easy Bloomberg
9,01:08PM,Google to enforce Play store tax on the 3% of apps not paying Reuters
10,01:00PM,"Google to better enforce Play Store in-app purchase policies, ease use of third-party app stores TechCrunch"
11,08:05AM,Netflix price hike looms here's how much more money Netflix may haul in Yahoo Finance
12,04:30AM,Trump Ban on TikTok Is Temporarily Blocked by Federal Judge Bloomberg
13,02:55AM,"Alphabet Settles Sexual Misconduct Case, Will Spend $310M On Diversity Program SmarterAnalyst"
14,01:18AM,Google Continues Antitrust Practices In Shopping Search Even After $2.7B EU Fine: Report Benzinga
15,12:00AM,"Gaming, E-Commerce Deals Herald New Age for Polish Tech Bloomberg"
16,Sep-27-20 08:24PM,Judge temporarily blocks U.S. ban on TikTok downloads from U.S. app stores Reuters
17,11:15AM,U.S. judge blocks Trump administration's ban on new TikTok downloads Reuters
18,08:00AM,"Forget Hot IPOs, Buy These Top Tech Stocks Instead Motley Fool"
19,Sep-26-20 07:05PM,Judge rejects bid to delay TikTk U.S. app store ban set for Sunday Reuters
20,05:32PM,"What to Know About Judge Amy Coney Barrett, Trumps Supreme Court Nominee Barrons.com"
21,05:27PM,A Right-Leaning Court Will Tackle Some Big Business Cases. The Outcomes Arent Obvious. Barrons.com
22,12:26PM,"This Week in Apps: Redesigning the iOS 14 home screen, app makers form 'fairness' coalition, latest on TikTok ban TechCrunch"
23,10:49AM,TikTok Judge Schedules Sunday Hearing as Trumps Ban Looms Bloomberg
24,08:32AM,Opinion: Why Mr. Market doesnt care if democracy is collapsing Yahoo Finance
25,07:55AM,3 Cash-Cow Stocks to Buy Ahead of the Next Market Crash Motley Fool
26,Sep-25-20 08:05PM,Why Rival Bike Peddlers Could Help Boost Pelotons Stock Barrons.com
27,05:56PM,Google Policy Limits Ads for Election as It Does for Disasters Bloomberg
28,05:14PM,"Apple Decides to Waive 30% Cut of Paid Events on Facebook, but Only for 3 Months Motley Fool"
29,04:25PM,Apple Inc. stock outperforms competitors on strong trading day MarketWatch
30,04:25PM,"Amazon.com Inc. stock rises Friday, outperforms market MarketWatch"
31,04:25PM,"Alphabet Inc. Cl A stock rises Friday, still underperforms market MarketWatch"
32,01:24PM,Antitrust investigations into Google & Facebook heat up Yahoo Finance Video
33,Sep-24-20 05:21PM,Microsoft's Xbox boss: Video games undergoing the 'same transformation' as TV and music did Yahoo Finance
34,04:56PM,Alphabet to Help Employees Tackle Student Loans Motley Fool
35,04:36PM,PayPal and Square Could Gain as EU Mulls iPhone Payments Rules TheStreet.com
36,04:25PM,"Apple Inc. stock rises Thursday, outperforms market MarketWatch"
37,04:25PM,Amazon.com Inc. stock outperforms market on strong trading day MarketWatch
38,04:25PM,"Alphabet Inc. Cl A stock rises Thursday, outperforms market MarketWatch"
39,04:22PM,"Microsoft Bolsters Cloud Offerings With Azure, Teams Enhancements Investor's Business Daily"
40,04:16PM,How a U.S. Google Probe Could Shake Up Internet Search Barrons.com
41,03:16PM,"Amazon Chases Google, Microsoft Into the Game-Streaming Market Bloomberg"
42,03:10PM,The rotation to more value and cyclical sectors has already begun: Wealth Consulting Group CEO Yahoo Finance Video
43,02:43PM,"Alphabet, Facebook, Twitter CEOs Asked to Appear at Senate Hearing TheStreet.com"
44,02:19PM,"Google, Facebook CEOs Face Possible Subpoena From Senate Panel Bloomberg"
45,01:49PM,"Senate panel wants CEOs of Facebook, Google, Twitter to testify Oct. 1: report MarketWatch"
46,01:39PM,Judge says U.S. must defend or delay TikTok app store ban by Friday Reuters
47,01:12PM,TikTok Judge Tells U.S. to Delay Ban or Argue for It Friday Bloomberg
48,12:46PM,"Google, U.S. government prepare for battle over market power Reuters"
49,12:23PM,Alphabet Stock Should Be a Major Winner for the Shelter-In-Place Holidays Barrons.com
50,12:12PM,"Senate panel plans to issue subpoenas to CEO's of Google, Facebook, Twitter Reuters"
51,11:39AM,What a Biden presidency would mean for tech stocks Yahoo Finance
52,10:57AM,Facebook is a whole different animal and may not be able to exist in its current form under a new regime: expert Yahoo Finance Video
53,10:00AM,Coronavirus Is Teaching Me What I Cant Do Online Bloomberg
54,10:00AM,"Tech Veterans Try to Build a Kinder, More Thoughtful Facebook Bloomberg"
55,08:00AM,Apples App Store Isnt Evil Bloomberg
56,06:45AM,"Spotify, Match Launch Coalition to Protest App Store Rules Bloomberg"
57,06:06AM,The FAANG Stock News You Completely Missed Last Month Motley Fool
58,06:00AM,Influencers with Andy Serwer: Jessica Alba Yahoo Finance Video
59,04:09AM,Google Maps Adds Feature To Identify COVID-19 Hot Zones Benzinga
60,02:35AM,"Thailand takes first legal action against Facebook, Twitter over content Reuters"
61,Sep-23-20 10:27PM,GoodRx Surges 53% On Trading Debut After $1.1B IPO Benzinga
62,10:17PM,TikTok asks judge to block U.S. from barring app for download Reuters
63,06:24PM,Barr Remains Wary of Security Concerns in Oracles TikTok Deal Bloomberg
64,05:26PM,"DOJ's Investigation Of Google 'Important' For Stock, BofA Says Benzinga"
65,04:25PM,Apple Inc. stock underperforms Wednesday when compared to competitors MarketWatch
66,04:25PM,"Amazon.com Inc. stock falls Wednesday, underperforms market MarketWatch"
67,04:25PM,"Alphabet Inc. Cl A stock falls Wednesday, underperforms market MarketWatch"
68,03:07PM,TikTok asks judge to block U.S. from barring app for download Reuters
69,02:56PM,DOJ Petitions Congress to Curb Legal Protections for Internet Companies Motley Fool
70,12:33PM,Google Maps gets a COVID-19 layer TechCrunch
71,12:30PM,Where Will Amazon Be in 10 Years? Motley Fool
72,11:45AM,Facebook Tool Faulted for Lapses in Finding Voter Misinformation Bloomberg
73,11:37AM,Google Antitrust Lawsuit to Narrowly Focus on Search Dominance Motley Fool
74,10:19AM,EU's antitrust probe of Google-Fitbit gets more time TechCrunch
75,06:08AM,Is This Hot IPO Stock a Better Buy Than Teladoc Health? Motley Fool
76,03:22AM,"Not All FAANG Stocks Are Going To Be Winners, Munster Says Benzinga"
77,Sep-22-20 10:29PM,Blacklisting U.S. Tech Would Highlight Chinas Own Weakness Bloomberg
78,09:15PM,Capital One and PayPal Veterans Roll Out Next-Generation Banking App Motley Fool
79,08:20PM,A $50 Phone is Ambani's Weapon to Dominate India Telecom Market Bloomberg
80,08:14PM,Trump to Meet With State Enforcers Before Expected Google Case Bloomberg
81,07:06PM,Why Shares of American Well Trounced the Market on Tuesday Motley Fool
82,06:55PM,Microsoft Guns for Twilio's Business With Launch of Azure Communication Services Motley Fool
83,06:14PM,Daily Crunch: Microsoft launches Azure Communication Services TechCrunch
84,05:19PM,'The stocks in the S&P 500 are not necessarily reflective of the full economy': Strategist Yahoo Finance Video
85,04:25PM,"Apple Inc. stock rises Tuesday, still underperforms market MarketWatch"
86,04:25PM,"Amazon.com Inc. stock rises Tuesday, outperforms market MarketWatch"
87,04:25PM,"Alphabet Inc. Cl A stock rises Tuesday, outperforms market MarketWatch"
88,03:53PM,How Tesla stacks up against other tech juggernauts at similar stages theres good news and bad news MarketWatch
89,03:25PM,"Mnuchin, Powell promise action to aid economic recovery Yahoo Finance Video"
90,03:11PM,Amazon Restricts Ads for Competing Electronic Devices Motley Fool
91,03:05PM,Top 20 Richest People In The World Insider Monkey
92,01:50PM,11 Craziest Money-Losing Wall Street Moves in History GOBankingRates
93,01:26PM,Disney Plus Now Streaming on Google Assistant Smart-Display Devices via Voice Commands Variety
94,12:32PM,"Alphabet (GOOG) Has Risen 19% in Last One Year, Outperforms Market Insider Monkey"
95,09:46AM,"Google launches a work-tracking tool and Airtable rival, Tables TechCrunch"
96,09:04AM,"TikTok, WeChat and the growing digital divide between the US and China TechCrunch"
97,08:42AM,"Facebook Campaigners Skirt Rules in Guinea Vote, Study Says Bloomberg"
98,08:20AM,Could Asana Be a Millionaire-Maker Stock? Motley Fool
99,07:26AM,"The market may have peaked so head for the multiasset hills and buy these stocks, says fund manager MarketWatch"
