,0,1
0,Sep-28-20 05:01PM,"Avnet, Inc. -- Moody's announces completion of a periodic review of ratings of Avnet, Inc. Moody's"
1,03:23PM,Texas Instruments Incorporated's (NASDAQ:TXN) Stock Been Rising: Are Strong Financials Guiding The Market? Simply Wall St.
2,10:27AM,Best Dividend Stocks for October 2020 Investopedia
3,Sep-24-20 08:35AM,Is Texas Instruments Stock a Buy? Motley Fool
4,Sep-22-20 05:50PM,Texas Instruments (TXN) Outpaces Stock Market Gains: What You Should Know Zacks
5,Sep-21-20 12:45PM,Better Buy: Western Digital vs. Texas Instruments Motley Fool
6,12:35PM,"Texas Instruments, Incorporated -- Moody's announces completion of a periodic review of ratings of Texas Instruments, Incorporated Moody's"
7,07:08AM,Texas Instruments to Reward Investors With 13% Dividend Hike Zacks
8,Sep-20-20 06:30PM,Investing in These Stocks Now Could Make You a Millionaire Retiree Motley Fool
9,Sep-19-20 08:30AM,Microsoft and Texas Instruments Increase Their Dividends Barrons.com
10,Sep-18-20 02:20AM,Texas Instruments To Hike Quarterly Dividend By 13% SmarterAnalyst
11,Sep-17-20 04:24PM,Texas Instruments raises dividend by 13% MarketWatch
12,04:01PM,TI to return more cash to shareholders with 13% dividend increase PR Newswire
13,Sep-16-20 05:45PM,Texas Instruments (TXN) Dips More Than Broader Markets: What You Should Know Zacks
14,Sep-15-20 08:00PM,The Argus Dividend Growth Portfolio Argus Research
15,01:00AM,New PSpice® for TI tool helps engineers speed time to market with system-level circuit simulation and verification PR Newswire
16,Sep-13-20 10:52AM,3 Stocks for an Electric Vehicle Future Not Named Tesla or Nikola Motley Fool
17,Sep-10-20 05:50PM,Texas Instruments (TXN) Dips More Than Broader Markets: What You Should Know Zacks
18,Sep-09-20 08:00PM,Seeking Direction After Hot Summer Argus Research
19,11:30AM,Is Texas Instruments (TXN) Stock Outpacing Its Computer and Technology Peers This Year? Zacks
20,Sep-08-20 07:02AM,Global Semiconductor Sales Rise YoY in July: 5 Stocks to Buy Zacks
21,Sep-07-20 08:00AM,Why Texas Instruments Stock Rose 11.4% in August Motley Fool
22,Sep-03-20 08:54AM,Texas Instruments (TXN) to Gain Traction With New Converters Zacks
23,Sep-02-20 05:45PM,Texas Instruments (TXN) Outpaces Stock Market Gains: What You Should Know Zacks
24,08:25AM,3 Dividend-Paying Tech Stocks to Buy Right Now Motley Fool
25,Sep-01-20 01:27PM,"The Zacks Analyst Blog Highlights: Apple, Salesforce and Texas Instruments Zacks"
26,09:00AM,TI introduces the industry's first DC/DC buck-boost converter to extend battery life by 50% and offer lowest IQ PR Newswire
27,Aug-31-20 01:03PM,Hedge Funds Are Betting On Texas Instruments Incorporated (TXN) Insider Monkey
28,Aug-27-20 03:11PM,Texas Instruments (NASDAQ:TXN) Has Gifted Shareholders With A Fantastic 243% Total Return On Their Investment Simply Wall St.
29,01:50PM,TI CEO Rich Templeton to deliver keynote at Citi investor conference PR Newswire
30,Aug-25-20 01:24PM,"Top Stock Reports for JNJ, Procter & Gamble & Thermo Fisher Zacks"
31,09:15AM,Top Ranked Income Stocks to Buy for August 25th Zacks
32,Aug-24-20 11:30AM,Is Texas Instruments (TXN) Outperforming Other Computer and Technology Stocks This Year? Zacks
33,Aug-22-20 09:27AM,Barrons Stock Pick: Synaptics Makeover Could Lead to Dramatic Growth Barrons.com
34,Aug-21-20 10:24AM,Top Ranked Income Stocks to Buy for August 21st Zacks
35,09:15AM,Better Buy: NVIDIA vs. Texas Instruments Motley Fool
36,Aug-20-20 11:30AM,Why Is Texas Instruments (TXN) Up 4.5% Since Last Earnings Report? Zacks
37,10:24AM,"The Zacks Analyst Blog Highlights: Maxim Integrated Products, Analog Devices, Texas Instruments and NVIDIA Zacks"
38,10:04AM,"Zacks Earnings Trends Highlights: Texas Instruments, Advanced Micro Devices, Whirlpool and Cognizant Zacks"
39,Aug-19-20 09:33PM,"Got $3,000 to Invest? These 3 IoT Stocks Could Make You a Fortune Motley Fool"
40,12:01PM,Understanding Texas Instruments's Unusual Options Activity Benzinga
41,09:42AM,Semiconductor-General Stock Outlook: Moderately Positive Prospects Zacks
42,07:04AM,Red-Hot NVIDIA & Other Chip Bigwigs to Add to Your Portfolio Zacks
43,Aug-18-20 04:01PM,Haviv Ilan named chief operating officer of TI PR Newswire
44,Aug-14-20 10:41AM,"Grocery Outlet, Wix.com, Texas Instruments, Etsy and Teradyne highlighted as Zacks Bull and Bear of the Day Zacks"
45,Aug-13-20 04:03PM,3 Growth Stocks with the Highest Zacks Rank Zacks
46,12:21PM,"Zacks Earnings Trends Highlights: Texas Instruments, AMD, Whirlpool and Cognizant Zacks"
47,Aug-10-20 07:00AM,"A Big Fund Manager Sold Berkshire, Verizon and GE Stock. It Bought This Chip Stock. Barrons.com"
48,Aug-07-20 11:30AM,Has Texas Instruments (TXN) Outpaced Other Computer and Technology Stocks This Year? Zacks
49,Aug-06-20 11:10AM,Semiconductor ETFs Roaring to New Highs on Solid Earnings Zacks
50,08:45AM,"Zacks Earnings Trends Highlights: Texas Instruments, Advanced Micro Devices, Whirlpool and Cognizant Zacks"
51,Aug-05-20 03:00AM,Texas Instruments Rises Amid Coronavirus Market Recovery; Can It Sustain The Gain? Investor's Business Daily
52,Aug-03-20 11:22AM,"The Zacks Analyst Blog Highlights: Shopify, T-Mobile US, Texas Instruments, Asure and Calix Zacks"
53,Aug-02-20 06:53PM,10 US Companies With Highest Revenue Exposure To China Insider Monkey
54,05:30PM,3 Stocks for a Better Retirement Motley Fool
55,Jul-31-20 08:00PM,Trane Stock: a Very Cool Pick Barrons.com
56,Jul-30-20 11:52AM,10 Biggest Semiconductor Companies Investopedia
57,11:17AM,"Zacks Earnings Trends Highlights: Texas Instruments, JPMorgan, Whirlpool and Goldman Sachs Zacks"
58,Jul-28-20 08:43AM,"The Zacks Analyst Blog Highlights: Facebook, Alphabet, Texas Instruments, Dollar General and Kroger Zacks"
59,Jul-27-20 02:15PM,"SWKS, STM or TXN: Which Looks Best Post-Earnings? Zacks"
60,11:30AM,Why Texas Instruments Is a Great Dividend Stock Motley Fool
61,10:45AM,Tech Analyst Says Valuations Hit a Wall Following Recent Gains Bloomberg
62,Jul-26-20 10:00AM,Only Three Days Left To Cash In On Texas Instruments' (NASDAQ:TXN) Dividend Simply Wall St.
63,Jul-23-20 10:42AM,"Zacks Earnings Trends Highlights: Texas Instruments, JPMorgan, Whirlpool and Goldman Sachs Zacks"
64,07:10AM,Like Dividends? I Bet You'll Love These 3 Stocks. Motley Fool
65,04:51AM,"STMicro Raises 3Q, FY Guidance on Improved Market Conditions Bloomberg"
66,Jul-22-20 02:37PM,Let's Try to Graph Out Texas Instruments' Correction TheStreet.com
67,01:54PM,"AMD, IBM, Texas Instruments: Tech Stock Midday Movers TheStreet.com"
68,11:30AM,Is Texas Instruments (TXN) Stock Outpacing Its Computer and Technology Peers This Year? Zacks
69,10:33AM,China will be pulled back to top of investor concerns after earnings season: Strategist Yahoo Finance Video
70,10:05AM,"Texas Instruments (TXN) Q2 Earnings Beat, Revenues Down Y/Y Zacks"
71,09:56AM,"Dow Jones Today, Stocks Turn Higher: Tesla, Microsoft Rise Ahead Of Earnings; Pfizer Spikes On HHS Vaccine Deal Investor's Business Daily"
72,09:43AM,"Taiwan Semiconductor Manufacturing Company, Boot Barn, Snap, Texas Instruments and TD Ameritrade highlighted as Zacks Bull and Bear of the Day Zacks"
73,09:35AM,"Benzinga's Top Upgrades, Downgrades For July 22, 2020 Benzinga"
74,09:07AM,Is There Now An Opportunity In Texas Instruments Incorporated (NASDAQ:TXN)? Simply Wall St.
75,08:55AM,Texas Instruments' Debt Overview Benzinga
76,08:14AM,Dow Jones Futures Fall 100 Points On U.S.-China Tensions; Pfizer Soars 5% On Coronavirus Vaccine Deal Investor's Business Daily
77,03:47AM,Texas Instruments Provides Upbeat Sales Outlook; Top Analyst Sees 18% Upside SmarterAnalyst
78,Jul-21-20 09:00PM,Texas Instruments Inc (TXN) Q2 2020 Earnings Call Transcript Motley Fool
79,08:24PM,[video]6 Key Takeaways from Texas Instruments' Earnings Report and Call TheStreet.com
80,07:13PM,Texas Instruments Gives Strong Forecast But Urges Caution Bloomberg
81,05:44PM,Texas Instruments Q2 Earnings Beat Forecasts TheStreet.com
82,05:25PM,Texas Instruments (TXN) Q2 Earnings and Revenues Surpass Estimates Zacks
83,05:08PM,Texas Instruments Gives Strong Forecast on Inventory Buildup Bloomberg
84,05:08PM,"Chipmaker Texas Instruments Tops Second-Quarter Targets, Guides Higher Investor's Business Daily"
85,05:05PM,Recap: Texas Instruments Q2 Earnings Benzinga
86,04:49PM,Texas Instruments Stock Is Rising Because Earnings Crushed Expectations Barrons.com
87,04:12PM,"Texas Instruments stock rises on earnings, outlook beat MarketWatch"
88,04:01PM,TI reports second quarter 2020 financial results and shareholder returns PR Newswire
89,01:50PM,A Look Into Texas Instruments' Debt Benzinga
90,08:57AM,"The Zacks Analyst Blog Highlights: Texas Instruments, Teradyne, Intel, MaxLinear and NXP Semiconductors Zacks"
91,06:05AM,Big Earnings Week for Chip Bellwethers: 2 Solid Buys Zacks
92,Jul-20-20 08:52AM,Can Texas Instruments Sustain Its Earnings Beat Trend in Q2? Zacks
93,08:50AM,Is a Surprise Coming for Texas Instruments (TXN) This Earnings Season? Zacks
94,Jul-17-20 09:28AM,What's in Store for Texas Instruments' (TXN) Q2 Earnings? Zacks
95,Jul-16-20 05:01PM,"Intel, Texas Instruments To Kickstart Chip Earnings With 'Better-Than-Feared' Results Benzinga"
96,04:10PM,Texas Instruments board declares third quarter 2020 quarterly dividend PR Newswire
97,Jul-15-20 12:10PM,Can Texas Instruments (TXN) Keep the Earnings Surprise Streak Alive? Zacks
98,Jul-14-20 12:30PM,Earnings Preview: Texas Instruments (TXN) Q2 Earnings Expected to Decline Zacks
99,Jul-13-20 12:38PM,Analog Devices to Buy Rival Maxim in $21 Billion Chip Deal Bloomberg
