,0,1
0,Sep-28-20 10:38PM,Dow Jones Futures: Stock Market Rally Needs To Pump Up The Volume; 7 Leaders In Buy Zones Investor's Business Daily
1,04:21PM,"Is Nvidia Stock A Buy Now? M&A Fuels Earnings Boom, Shares Find Key Support Investor's Business Daily"
2,04:05PM,"Stock market news live updates: Stocks jump, Dow gains 411 points Yahoo Finance"
3,03:50PM,"Amazon, Apple, Nvidia, Netflix, PayPal, ServiceNow: Who Got Cut Or Trimmed? Investor's Business Daily"
4,02:46PM,"Snowflake, Homebuilders, Money Girl, and More Motley Fool"
5,02:05PM,"Top Analyst Reports for P&G, Verizon & Thermo Fisher Zacks"
6,12:14PM,Will This Bullish Option Trade In Nvidia Produce A 35% Profit By November? Investor's Business Daily
7,09:55AM,"Dow Jones Today, Stocks Track Global Rally; Tesla, Apple, Boeing Surge; Chips Mixed On SMIC Ban Investor's Business Daily"
8,09:48AM,NVIDIA's $40 Billion Splurge Could Supercharge This Business Motley Fool
9,08:19AM,Dow Jones Futures Jump As Stock Market Looks To Confirm New Rally Investor's Business Daily
10,07:29AM,Dow Jones Futures: Stock Market Rally Shows Bullish Action; How To Game Plan For A Key Week Investor's Business Daily
11,06:44AM,"The Zacks Analyst Blog Highlights: Intel, Google, Qualcomm, General Motors, Nvidia and Baidu Zacks"
12,Sep-27-20 03:00PM,"ServiceNow, Nvidia, Qualcomm Near Buy Points In Stock Market Rally Attempt Investor's Business Daily"
13,Sep-26-20 08:30AM,Is This Massive NVIDIA Catalyst About to Make a Comeback? Motley Fool
14,Sep-25-20 04:13PM,Nvidia Seeing 'Massive Demand' For Graphics Cards Thanks To Gaming Investor's Business Daily
15,01:22PM,3 Very Influential Tech Stocks to Buy InvestorPlace
16,12:09PM,"Dow Jones Erases Losses, As Apple, Tesla Jump; Novavax Surges 14% On Coronavirus Vaccine News Investor's Business Daily"
17,11:02AM,"Chart Reading: 3 Telltale Clues To Look For In Nvidia, Netflix Investor's Business Daily"
18,09:20AM,'Unstoppable' Nvidia Should Be Watched Closely Near-Term TheStreet.com
19,08:16AM,Dow Jones Futures Fall: Look For This Bullish Stock Market Signal; Tech Titans Hold Key Support Investor's Business Daily
20,07:15AM,"Got $3,000? Here Are 3 Surefire High-Growth Stocks That Are Just Getting Started Motley Fool"
21,07:00AM,Nvidia Stock Has Rocketed. Director Stephen Neal Bought More Shares. Barrons.com
22,03:05AM,Nvidia Will Purchase Arm Only If China Lets It Benzinga
23,Sep-24-20 05:21PM,Microsoft's Xbox boss: Video games undergoing the 'same transformation' as TV and music did Yahoo Finance
24,02:09PM,Amazon launches Luna cloud gaming service competing with Microsoft and Google Yahoo Finance
25,01:20PM,"Dow Jones Advances 250 Points, As Apple, Tesla Snap Back; Nikola Plummets 23% On Downgrade Investor's Business Daily"
26,01:02PM,US STOCKS-Tech stocks lift Wall Street as economic rebound slows Reuters
27,11:44AM,US STOCKS-Nasdaq rises on tech boost as economic recovery cools Reuters
28,10:30AM,Why Microsoft Paid $7.5 Billion for Gaming Wizard ZeniMax Zacks
29,10:25AM,US STOCKS-Nasdaq rises on tech boost as economic recovery cools Reuters
30,Sep-23-20 05:45PM,"Nvidia Stock, IBD 50 Stock To Watch, Hits Buy Zone After 78% Advance Investor's Business Daily"
31,08:00AM,NVIDIA Once Again Demonstrates Its Investing Chops With Arm Deal Motley Fool
32,Sep-22-20 08:05PM,Why NVIDIA Corp. (NVDA) Is Buying SoftBanks ARM Insider Monkey
33,05:45PM,Nvidia (NVDA) Gains But Lags Market: What You Should Know Zacks
34,04:02PM,Investing In Stocks: See How To Invest In 3 Simple Steps Investor's Business Daily
35,02:49PM,Nvidia Is Likely Pleased with ARM's Latest Server CPU Work TheStreet.com
36,07:30AM,Why Cryptocurrency Miners Love Nvidias New Graphics Chips Barrons.com
37,07:00AM,Artificial Intelligence Stocks To Buy And Watch Amid Rising AI Competition Investor's Business Daily
38,04:15AM,Li Auto Inc. Announces the Adoption of NVIDIA's Next Generation Autonomous Driving Smart Chip Orin GlobeNewswire
39,02:24AM,Nvidia Issues Mea Culpa Over Bungled GeForce RTX 3080 Launch SmarterAnalyst
40,12:57AM,Nvidia Purchase Of Arm Faces UK Scrutiny Benzinga
41,Sep-21-20 11:10PM,Britain assessing impact of sale of Arm to Nvidia - minister Reuters
42,07:26PM,Britain assessing impact of sale of Arm to Nvidia: minister Reuters
43,07:11PM,Britain assessing impact of sale of Arm to Nvidia - minister Reuters
44,05:47PM,"Dow Jones Futures: Stock Market Rally Gets Boost From Apple, AMD, Big Techs; Tesla Dives Late On Elon Musk Battery Day News Investor's Business Daily"
45,12:35PM,"Advanced Micro Devices, Inc. -- Moody's announces completion of a periodic review of ratings of Advanced Micro Devices, Inc. Moody's"
46,12:34PM,NVIDIA Corporation -- Moody's announces completion of a periodic review of ratings of NVIDIA Corporation Moody's
47,11:30AM,Micron Technology or NVIDIA: Which One to Buy Right Now? Motley Fool
48,Sep-20-20 09:08PM,"Barron's Picks And Pans: Ackman Picks, Albertsons, Nvidia And More Benzinga"
49,11:35AM,Nvidias Latest Deal Could Make It the Worlds Most Important Chip Maker Barrons.com
50,07:29AM,These 3 Stocks Could Soar if Biden Beats Trump Motley Fool
51,Sep-18-20 04:03PM,SoftBank Deal to Sell Arm Has $1.25 Billion Breakup Clause. Nvidia Pays $750 Million Licensing Fee. Barrons.com
52,04:02PM,"Stock Market Rally Reverses Lower: Apple, Adobe, Nvidia, Nikola, Snowflake, TikTok, Fed Meeting In Focus Investor's Business Daily"
53,11:30AM,Nvidia (NVDA) Up 2.7% Since Last Earnings Report: Can It Continue? Zacks
54,08:59AM,The biggest semiconductor deal in history should have been even bigger Quartz
55,08:00AM,Do You Own The 10 Most Expensive Stocks Right Now? Investor's Business Daily
56,08:00AM,"Top Stocks Nvidia, Taiwan Semi Still In Reach Thanks To These Tech Plays Investor's Business Daily"
57,02:32AM,Nvidia's Acquisition Of Arm Proves A Boon For Rival Chipmaker Benzinga
58,Sep-17-20 09:48PM,Arm rival SiFive says Nvidia deal spurs interest in its technology Reuters
59,08:57PM,PRESS DIGEST-British Business - Sept 18 Reuters
60,08:44PM,Arm rival SiFive says Nvidia deal spurs interest in its technology Reuters
61,08:22PM,Arm rival SiFive says Nvidia deal spurs interest in its technology Reuters
62,01:31PM,NVIDIA's High-Powered GeForce RTX 3080 Has Already Sold Out Motley Fool
63,01:25PM,Nvidia Analyst Says Chipmaker Could Try This 'Plan B' If Arm Deal Falls Through Benzinga
64,01:02PM,Why SoftBank's Arm Holdings Sale Is a Winning Move Motley Fool
65,12:33PM,NVIDIA to Acquire Softbank's Arm Limited: 3 Investing Takeaways Motley Fool
66,11:06AM,We Like These Underlying Trends At NVIDIA (NASDAQ:NVDA) Simply Wall St.
67,10:43AM,"Where to Invest $5,000 Right Now Motley Fool"
68,01:00AM,INSIGHT-The Musk Method: Learn from partners then go it alone Reuters
69,Sep-16-20 04:04PM,"Berry Global: IBD 50 Stock With 69% EPS, 50% Sales Growth, Packages New Base Investor's Business Daily"
70,10:04AM,"China state media outlet calls Nvidia's Arm purchase 'disturbing', urges regulatory caution Reuters"
71,07:41AM,"Arm China investor sues company, escalating CEO spat amid sale Reuters"
72,Sep-15-20 09:15PM,"China state media outlet calls Nvidia's Arm purchase 'disturbing', urges regulatory caution Reuters"
73,09:13PM,"CORRECTED-China state media outlet calls Nvidia's Arm purchase 'disturbing', urges regulatory caution Reuters"
74,07:34PM,Wall Street Continues to Rave About Nvidias Arm Deal. Here Are 5 Reasons Why. Barrons.com
75,03:34PM,"Nvidia Stock Will Soar 35% to $700, According to This Analyst Motley Fool"
76,03:05PM,Nvidia Could Reach New Highs as We Move Into Autumn TheStreet.com
77,02:35PM,Big Mergers and IPOs Are Back. Dont Expect Them to Slow Down. Barrons.com
78,01:45PM,Nvidia Gets New Street-High Price Target On Arm Deal: 'Ubiquitous Across Semi Industry' Benzinga
79,12:50PM,Nvidia Deal Threatens Arms Role as the Switzerland of Chips Bloomberg
80,12:35PM,The M&A surge: Is it rational exuberance or a frenzy before the market falls? MarketWatch
81,12:08PM,"Dow Jones Gains 225 Points As Tech Rally Continues; Apple, Tesla Jump; Nikola Dives 10% On SEC Investigation Investor's Business Daily"
82,10:52AM,Morning Bell With Jim Cramer: Amazon and Nvidia Are Growing TheStreet.com
83,09:56AM,"Semiconductor stocks are hot, and these numbers say they have more room to run MarketWatch"
84,09:55AM,"Dow Jones Today, Stocks Jump As BioNTech Gets Vaccine Boost; Tesla Aims To Extend Rebound Investor's Business Daily"
85,09:55AM,Tax policies after 2020 election may dampen M&A action: expert Yahoo Finance Video
86,09:32AM,Nvidia Share-Price Target at Needham Is Wall Street High TheStreet.com
87,09:09AM,Nvidia stock gains after Needham boosts target to new Street high of $700 MarketWatch
88,09:00AM,How NVIDIA's $40 Billion Arm Acquisition Could Reshape the Mobile Chip Industry Motley Fool
89,08:39AM,NVIDIA's $40 Billion Takeover of Arm Spells Trouble for Intel and AMD Motley Fool
90,07:25AM,"Stock market news live updates: Stock futures rise, Nasdaq paces toward back-to-back sessions of gains Yahoo Finance"
91,03:01AM,Analyst Report: NVIDIA Corporation Morningstar Research
92,02:31AM,RPT-GRAPHIC-Tech leads crisis-driven M&A boom with $350 billion deal rush Reuters
93,12:15AM,"FOREX-Dollar softer on improved risk appetite, yuan soars Reuters"
94,Sep-14-20 09:08PM,PRESS DIGEST-British Business - Sept. 15 Reuters +5.82%
95,09:05PM,FOREX-Dollar softer as sentiment recovers on vaccine hopes and deals Reuters
96,07:01PM,Jim Cramer: Is This Market Undervalued? TheStreet.com
97,06:11PM,"The Dow Gained 327 Points, but the Nasdaq 100s Rise Might Have Been More Important Barrons.com"
98,05:39PM,"There's a '50/50 chance' of delay of Nvidia deal, says analyst Yahoo Finance Video"
99,05:21PM,4 Interesting Things Nvidia Just Shared About its Plans for ARM TheStreet.com
