,0,1
0,Sep-28-20 04:21PM,"Is Nvidia Stock A Buy Now? M&A Fuels Earnings Boom, Shares Find Key Support Investor's Business Daily"
1,08:19AM,Dow Jones Futures Jump As Stock Market Looks To Confirm New Rally Investor's Business Daily
2,07:29AM,Dow Jones Futures: Stock Market Rally Shows Bullish Action; How To Game Plan For A Key Week Investor's Business Daily
3,Sep-27-20 06:07PM,"Notable Insider Buys Last Week: Snowflake, Broadcom And More Benzinga"
4,01:00PM,Momentum Stock Broadcom (AVGO) May Have Topped Out Investopedia
5,08:00AM,3 Top Tech Stocks to Buy in October Motley Fool
6,Sep-25-20 02:20PM,"Broadcom Stock Is Rising, and Chairman Henry Samueli Scooped Up Shares Barrons.com"
7,11:33AM,Broadcom Nears Accord to End EU Probe of Chip Sales Contracts TheStreet.com
8,11:04AM,Broadcom Tight In Wild Market Investor's Business Daily Video
9,10:17AM,Broadcom Poised to Settle EU Antitrust Probe Into Chip Sales Bloomberg
10,Sep-23-20 05:45PM,"Nvidia Stock, IBD 50 Stock To Watch, Hits Buy Zone After 78% Advance Investor's Business Daily"
11,Sep-22-20 04:53PM,Broadcom Inc. -- Moody's announces completion of a periodic review of ratings of Broadcom Technologies Inc. Moody's
12,08:06AM,"Forget Micron, Buy These 4 Top Semiconductor Stocks Instead Zacks"
13,Sep-21-20 01:52PM,"The Zacks Analyst Blog Highlights: NEP, AVGO and LMT Zacks"
14,Sep-18-20 05:38PM,"MACOM Technology Solutions Holdings, Inc. -- Moody's announces completion of a periodic review of ratings of MACOM Technology Solutions Holdings, Inc. Moody's"
15,08:00AM,Semiconductor Stocks To Buy And Watch Before Third-Quarter Earnings Investor's Business Daily
16,Sep-17-20 04:10PM,"3 Stocks to Buy for Long-Term Growth and High, Treasury-Beating Yields Zacks"
17,12:00PM,Better Buy: Skyworks Solutions vs. Broadcom Motley Fool
18,Sep-16-20 06:04AM,Read This Before Considering Broadcom Inc. (NASDAQ:AVGO) For Its Upcoming US$3.25 Dividend Simply Wall St.
19,Sep-15-20 07:34PM,Wall Street Continues to Rave About Nvidias Arm Deal. Here Are 5 Reasons Why. Barrons.com
20,07:00AM,"If You're Retired, Consider Buying These 3 Stocks Motley Fool"
21,Sep-14-20 02:49PM,Nvidia Buys SoftBanks Arm in Record $40 Billion Chip Deal Bloomberg
22,08:35AM,Nvidia Is Buying Arm Holdings From SoftBank in the Largest Ever Chip Deal Barrons.com
23,Sep-10-20 08:00PM,Technical Assessment: Bullish in the Intermediate-Term Argus Research
24,04:30PM,Broadcom Inc. to Present at Deutsche Bank Technology Conference PR Newswire
25,08:00AM,Broadcom Samples Industrys Highest-Performing Routing Chip at 14.4 Terabits per Second GlobeNewswire
26,Sep-09-20 08:36PM,"Broadcom: Next Stop, $430? TipRanks"
27,04:10PM,Qorvo Guidance Lifts Smartphone Chipmakers As 5G Boom Nears Investor's Business Daily
28,01:07PM,Why Broadcom Inc. (NASDAQ:AVGO) Could Be Worth Watching Simply Wall St.
29,10:10AM,3 5G Stocks to Buy Now Motley Fool
30,09:33AM,Analyzing Broadcom's Unusual Options Activity Benzinga
31,08:34AM,CrowdStrike Continues to Win Big After Broadcom's Symantec Acquisition Motley Fool
32,Sep-08-20 08:33AM,Inverse Tech ETFs Jump as Traders Book Profits Investopedia
33,Sep-07-20 08:48PM,What to Expect in the Markets This Week Investopedia
34,08:00PM,"Market Update: AVGO, COST, NI Argus Research"
35,08:00PM,Analyst Report: Broadcom Inc Argus Research
36,Sep-04-20 04:55PM,US STOCKS- Wall St ends lower as Nasdaq rout persists Reuters
37,04:00PM,US STOCKS- Wall St ends lower as Nasdaq rout persists Reuters
38,03:57PM,"Bullish Broadcom Analysts Lift Price Targets, Highlight Execution, iPhone Exposure Benzinga"
39,03:36PM,Jim Cramer: How Much Cash Is There to Go Around? TheStreet.com
40,03:36PM,Broadcom Reported Earnings Thursday. Heres What Analysts Are Saying. Barrons.com
41,03:08PM,"CORRECTED-US STOCKS-Tech rout deepens, Nasdaq set for worst two-day fall since March Reuters"
42,01:50PM,Why Broadcom Stock Gained Today Motley Fool
43,01:42PM,"REFILE-US STOCKS-Tech rout deepens, Nasdaq set for worst two-day fall since March Reuters"
44,01:29PM,Broadcom Beats Earnings - Here's the Trade Now TheStreet.com
45,01:22PM,"DocuSign, Domo, NCino: Midday Tech Stock Movers TheStreet.com"
46,11:50AM,US STOCKS-Wall Street sinks as tech sell-off continues Reuters
47,10:45AM,US STOCKS-Wall Street sinks as tech sell-off resumes Reuters
48,10:43AM,P/E Ratio Insights for Broadcom Benzinga
49,10:06AM,"Broadcom Has Room to Boost Dividend by 10%, Truist Analysts Say. Well See, Chip Maker Says. Barrons.com"
50,10:04AM,Broadcom May Be Nearing the End of Its Run Higher: Here's How to Trade It TheStreet.com
51,10:00AM,"Docusign, Broadcom beat estimates in their latest quarterly reports Yahoo Finance Video"
52,07:52AM,Dow Jones Today: Tech Futures Fall Sharply Ahead Of Jobs Report After Stock Market Rally Rout Investor's Business Daily
53,07:48AM,"Dow Futures, Jobs, DocuSign, Google - 5 Things You Must Know Friday TheStreet.com"
54,07:30AM,Broadcom's Debt Overview Benzinga
55,Sep-03-20 11:58PM,Analyst Report: Broadcom Inc. Morningstar Research -6.11%
56,11:46PM,Broadcom Down Even As Earnings Impress; Analyst Ramps PT To $390 SmarterAnalyst
57,11:30PM,Broadcom Ltd (AVGO) Q3 2020 Earnings Call Transcript Motley Fool
58,05:17PM,China Semiconductor Threat Sparked a $100 Billion Chip Rout Bloomberg
59,05:17PM,Broadcom Says Wireless Sales Will Rebound. Heres What Else to Know From Its Earnings. Barrons.com
60,05:16PM,Chipmaker Broadcom Beats Q3 Targets On Lift From Software Sales Investor's Business Daily
61,05:12PM,Broadcom: Q3 Earnings Insights Benzinga
62,05:09PM,"Dow Jones Futures: Stock Market Rally Sells Off Hard As Apple, Tesla, Big Techs Plunge; What You Shouldn't Do Now Investor's Business Daily"
63,04:55PM,Broadcom Shares Up on Results and Guidance TheStreet.com
64,04:36PM,Broadcom Predicts Smartphone Chip Rebound in Bullish Forecast Bloomberg
65,04:29PM,"Broadcom shares rise as earnings, outlook top Street view MarketWatch"
66,04:22PM,"Broadcom signals delay in iPhone chip ramp-up, pointing to later release date Reuters"
67,04:20PM,The Stock Market Is Getting Crushed. Why Its Riskiest Stocks Have Been the Safest Place to Hide. Barrons.com
68,04:15PM,Broadcom Inc. Announces Third Quarter Fiscal Year 2020 Financial Results and Quarterly Dividends PR Newswire
69,03:32PM,The Tech Stock Selloff Is Accelerating. It Was Time for a Pullback. Barrons.com
70,08:07AM,"Dow Jones Futures Dip Before Jobless Claims; Tesla, Apple, CrowdStrike Pressure Techs As Stock Market Rally Flashes Warning Signs Investor's Business Daily"
71,07:50AM,"Zuora, CrowdStrike, Broadcom, Robinhood - 5 Things You Must Know Thursday TheStreet.com"
72,Sep-02-20 10:03AM,A Preview Of Broadcom's Earnings Benzinga
73,08:00AM,Broadcom Delivers Industry's First In-band Management Application Reducing the Operational Cost and Complexity of SAN Ownership GlobeNewswire
74,06:55AM,3 Dividend-Paying Tech Stocks to Buy in September Motley Fool
75,Sep-01-20 06:26PM,Analyst Report: Broadcom Inc. Morningstar Research
76,08:49AM,3 High-Yield Tech Stocks to Buy in September Motley Fool
77,08:00AM,Broadcom Unveils Industrys First Gen 7 64Gb/s Fibre Channel Switching Platforms Enabling an Autonomous SAN GlobeNewswire
78,Aug-31-20 03:03PM,Here's What the Charts Say About AVGO Heading Into Earnings TheStreet.com
79,01:33PM,Hedge Funds Are Nibbling On Broadcom Inc (AVGO) Insider Monkey
80,11:29AM,"Kiplinger's Weekly Earnings Calendar (8/31-9/4): M, RKT, ZM Kiplinger"
81,11:02AM,Factors Setting the Tone for Broadcom's (AVGO) Q3 Earnings Zacks
82,08:15AM,"Zoom Video, Broadcom, DocuSign, and Other Stocks for Investors to Watch This Week Barrons.com"
83,Aug-30-20 09:30AM,"Top Earnings Next Week: Broadcom, H&R Block, Cooper and more TheStreet.com"
84,Aug-28-20 07:44PM,Amazon Isnt Synonymous With Luxury. That May Be Changing. Barrons.com
85,03:43PM,Buy Surging Chip Stock Broadcom (AVGO) for Its Dividend Yield and More? Zacks
86,12:39PM,"Price Gains And A Big Dividend, Too? Only 6 Stocks Pull It Off Investor's Business Daily"
87,Aug-27-20 12:30PM,Broadcom Inc. (AVGO) Reports Next Week: Wall Street Expects Earnings Growth Zacks
88,07:05AM,"Dont settle for skimpy bond yields and make dividend stocks your best income play, fixed-income veteran says MarketWatch"
89,Aug-26-20 10:38AM,Best Dividend Stocks for September 2020 Investopedia
90,Aug-24-20 05:45PM,Broadcom Inc. (AVGO) Outpaces Stock Market Gains: What You Should Know Zacks
91,08:50AM,Barrons Stock Pick: This Chip Companys Makeover Has Only Just Begun Barrons.com
92,Aug-20-20 09:44AM,Is Broadcom Stock a Buy? Motley Fool
93,Aug-18-20 07:43AM,3 Cheap Tech Stocks to Buy Right Now Motley Fool
94,Aug-17-20 05:45PM,Broadcom Inc. (AVGO) Outpaces Stock Market Gains: What You Should Know Zacks
95,05:51AM,"Got $1,500? Here Are 3 of the Safest Stocks to Buy Now Motley Fool"
96,Aug-14-20 11:29AM,"The Zacks Analyst Blog Highlights: Home Depot, AbbVie, Broadcom, 3M and Morgan Stanley Zacks"
97,Aug-13-20 01:17PM,"Top Analyst Reports for Home Depot, AbbVie & Broadcom Zacks"
98,09:15AM,"Got $3,000 to Invest? These 3 Tech Dividend Stocks Could Make You a Fortune Motley Fool"
99,Aug-12-20 05:17PM,How Broadcom May Have Helped Make Googles Latest AI Chip Barrons.com
