,0,1
0,Sep-28-20 10:38AM,It's Official: 2020 Is Cord Cutting's Pivotal Moment Motley Fool
1,Sep-25-20 09:30AM,Will Charter Communications (NASDAQ:CHTR) Multiply In Value Going Forward? Simply Wall St.
2,Sep-23-20 05:40PM,"GCI, LLC -- Moody's assigns B3 rating to GCI's new unsecured notes; outlook stable Moody's"
3,Sep-22-20 01:29PM,Nelson Peltz Has a Stake in Comcast. What It Means for the Stock. Barrons.com
4,09:00AM,Will This Activist Investor Try to Break Up Comcast? Motley Fool
5,Sep-21-20 11:15AM,Charter Relaunches Free 60-Day Spectrum Internet & WiFi Offer To Help Connect New Households With K-12 And College Students Or Educators PR Newswire
6,Sep-20-20 08:24AM,Paying too much for your cable bill? Here's how to save. Yahoo Finance
7,Sep-16-20 01:41PM,"Charter Communications Stock Hits a Record. We Like Cable, CEO Says. Barrons.com"
8,Sep-15-20 04:24PM,Comcast Stock Climbs Into Buy Zone As CEO Touts Biggest Broadband Quarter Ever Investor's Business Daily
9,12:21PM,Comcast Stock Climbs Into Buy Zone As CEO Touts Biggest Broadband Quarter Ever Investor's Business Daily
10,Sep-14-20 03:30PM,"GCI Holdings, Inc. -- Moody's assigns Ba2 rating to GCI's proposed amended and extended $900 million credit facility; B2 CFR affirmed on refinancing Moody's"
11,02:02PM,10 Biggest Mining Companies Investopedia
12,Sep-10-20 12:00PM,Charter to Participate in Goldman Sachs Virtual Communacopia Conference PR Newswire
13,Sep-09-20 02:05PM,10 Biggest Entertainment Companies Investopedia
14,Sep-04-20 12:46PM,Your internet bill might be too high here's how to save money Yahoo Finance
15,09:13AM,How 5G Cord-Cutting Could Help Verizon Eat Cable's Lunch Motley Fool
16,Sep-02-20 06:12PM,Cogecos Majority Investor Spurns Altices $7.8 Billion Bid Bloomberg
17,04:30PM,"Charter to Participate in Bank of America Virtual Media, Communications & Entertainment Conference PR Newswire"
18,Aug-30-20 11:30AM,Why Is Charter (CHTR) Up 9.3% Since Last Earnings Report? Zacks
19,10:59AM,"A Closer Look At Charter Communications, Inc.'s (NASDAQ:CHTR) Uninspiring ROE Simply Wall St."
20,Aug-26-20 11:17AM,Charter Communications (CHTR) Is Still A Popular Hedge Fund Pick Insider Monkey
21,Aug-24-20 02:56PM,Top Communications Stocks for September 2020 Investopedia
22,Aug-19-20 12:15PM,COVID-19 Offers Boost Charters Subscriber Growth Motley Fool
23,Aug-17-20 09:53PM,SoftBank Bets $3.9 Billion on U.S. Giants From Amazon to Tesla Bloomberg
24,09:00AM,Covid-19 Builds Suspense for the Fall TV Lineup Bloomberg
25,Aug-13-20 12:13PM,MARKETS: YF Premium Investment Idea: Charter Communications (CHTR) Yahoo Finance Video
26,Aug-11-20 04:56PM,SoftBank Is Targeting Over $10 Billion in Public Investing Bloomberg
27,Aug-10-20 09:35AM,Why the Founding Fathers would want us all to have fast Internet Yahoo Finance Video
28,04:00AM,Charter Gets a Little Help From Its Friends In Bid to Raise Fees Bloomberg
29,Aug-05-20 11:00AM,Charter Reports Surprise Gain in Video Subscribers Motley Fool
30,07:30AM,Why Charter Communications Stock Rose 13.7% in July Motley Fool
31,Aug-04-20 07:36AM,Does Charter Communications' (NASDAQ:CHTR) CEO Salary Compare Well With The Performance Of The Company? Simply Wall St.
32,Aug-03-20 09:31AM,A Look Into Charter Communications' Debt Benzinga
33,Jul-31-20 02:30PM,Charter Communications Inc (CHTR) Q2 2020 Earnings Call Transcript Motley Fool
34,12:46PM,Stocks Drop on Energy Selloff Amid Virus Jitters: Markets Wrap Bloomberg
35,11:14AM,Charter Stock Jumps to a Record After Blockbuster Earnings Barrons.com
36,11:02AM,How Earnings Amplify the Bull Case for Comcast Stock InvestorPlace
37,10:38AM,Charter Soars After Surprising Growth in TV Subscribers Bloomberg
38,10:07AM,Charter's (CHTR) Q2 Earnings and Revenues Beat Estimates Zacks
39,08:15AM,Charter Communications (CHTR) Tops Q2 Earnings and Revenue Estimates Zacks
40,07:00AM,Charter Announces Second Quarter 2020 Results PR Newswire
41,Jul-28-20 05:23PM,"Tesla, Fox, Charter Communications: RBC's Top Stock Picks for a Biden Presidency TheStreet.com"
42,08:57AM,Charter (CHTR) to Report Q2 Earnings: What's in the Cards? Zacks
43,Jul-24-20 04:10PM,Charter Closes $1.5 Billion Senior Unsecured Notes PR Newswire
44,12:30PM,Charter Communications (CHTR) Earnings Expected to Grow: Should You Buy? Zacks
45,Jul-22-20 09:00AM,"Column: Spectrum, like other big companies, seeks to abandon its merger promises LA Times"
46,Jul-21-20 10:03PM,Charter Prices $1.5 Billion Senior Unsecured Notes PR Newswire
47,08:56AM,Charter Offers Senior Unsecured Notes PR Newswire
48,Jul-20-20 04:00AM,"Giant Wireless Sale Offers 5G Spectrum Sliced Into 22,631 Pieces Bloomberg"
49,Jul-14-20 03:08PM,Comcasts Peacock Is a Bet Viewers Will Watch Ads for Free Streaming. It Launches Wednesday. Barrons.com
50,Jul-10-20 06:53PM,Cutting the Cord Is No Longer Cheap. Heres 1 Cable Stock That Could Benefit. Barrons.com
51,01:32PM,"Buy Charter Communications Stock to Bet on Home Broadband, Analyst Says Barrons.com"
52,Jul-09-20 04:10PM,Charter Closes $1.5 Billion Senior Unsecured Notes PR Newswire
53,12:34PM,"Charter Communications, Inc.'s (NASDAQ:CHTR) Intrinsic Value Is Potentially 49% Above Its Share Price Simply Wall St."
54,Jul-07-20 01:43PM,New York City to seek assessment on internet providers to fund low-income service Reuters
55,Jul-06-20 07:35PM,Charter Prices $1.5 Billion Senior Unsecured Notes PR Newswire
56,01:29PM,"CCO Holdings, LLC -- Moody's assigns a B1 rating to Charter's new senior unsecured notes Moody's"
57,08:54AM,Charter Offers Senior Unsecured Notes PR Newswire
58,Jul-02-20 05:46PM,"Were Hedge Funds Right About Flocking Into Charter Communications, Inc. (CHTR)? Insider Monkey"
59,Jun-29-20 11:07AM,These 10 Stocks Are Owned by Too Many Investors. That Could Be Bad News. Barrons.com
60,Jun-26-20 04:30PM,Charter to Hold Conference Call to Discuss Second Quarter 2020 Financial and Operating Results PR Newswire
61,Jun-25-20 05:33PM,"Charter Elevates Magesh Srinivasan To Executive Vice President, Network Operations And Adam Ray To Executive Vice President, Multi-Dwelling Unit Markets PR Newswire"
62,Jun-22-20 12:18PM,What to Do with Charter Communications (CHTR) Stock? Insider Monkey
63,Jun-11-20 04:10PM,Charter to Participate in Credit Suisse Virtual Communications Conference PR Newswire
64,02:39PM,Charter Invests $10 Million Dollars With National Urban League And National Action Network To Assist Black-owned Small Businesses In Underserved Communities PR Newswire
65,Jun-08-20 10:00AM,"Charter Launches 2020 Digital Education Grant Program, Part Of $6 Million, Four-Year Cash And In-Kind Commitment To Broadband Usage And Training PR Newswire"
66,Jun-02-20 01:49PM,Bill Nygren Adds 4 Stocks to Portfolio in 1st Quarter GuruFocus.com
67,11:04AM,5 Companies Reach 52-Week Highs GuruFocus.com
68,Jun-01-20 01:24PM,"Hedge Funds Surfing The Charter Communications, Inc. (CHTR) Wave Insider Monkey"
69,May-31-20 11:30AM,Why Is Charter (CHTR) Up 9.9% Since Last Earnings Report? Zacks
70,May-29-20 07:07AM,"MEDIA-Comcast, Charter and ViacomCBS join forces to make TV commercials more targeted - WSJ Reuters"
71,May-28-20 08:00PM,"GCI Holdings, Inc. -- Moody's affirms Ba2 Sr secured and B3 unsecured ratings of GCI; outlook stable Moody's"
72,May-27-20 06:00AM,"AT&T launches HBO Max, vying with Netflix, others for quarantine viewing Reuters"
73,May-20-20 04:23PM,Intel says it has acquired Rivet Networks MarketWatch
74,12:00PM,"HBO Max announces more launch partners; no deals yet with Amazon, Comcast, Roku Reuters"
75,09:23AM,Here are the hot dogs that hedge funds have used to outperform this year MarketWatch
76,08:40AM,Here's How Charter and Comcast Can Curb the Cord-Cutting Movement Motley Fool
77,May-19-20 10:05PM,"Hedge Funds Dumped Disney, Comcast For Charter Communications Insider Monkey"
78,May-18-20 07:26PM,Daniel Loeb Exits Campbell Soup and Trims Baxter in the 1st Quarter GuruFocus.com
79,May-15-20 05:53PM,Atlanta Braves Owner John Malone Has a Great Investing Record. Heres How to Play Along. Barrons.com
80,May-14-20 06:42AM,"Earnings season shows how fast companies have upped their digital game, says Goldman MarketWatch"
81,May-11-20 04:27PM,Who Needs TV? Cable Companies Stocks Are Now Driven by Broadband Growth Barrons.com
82,May-08-20 08:38PM,Cord-Cutting Is Accelerating Because of Coronavirus. Could This Be the End of Cable TV? Barrons.com
83,May-06-20 10:14AM,"The Zacks Analyst Blog Highlights: Alibaba, Verizon Communications, Coca-Cola, Tesla and Charter Communications Zacks"
84,May-05-20 11:31PM,Edited Transcript of CHTR earnings conference call or presentation 1-May-20 12:30pm GMT Thomson Reuters StreetEvents
85,06:46AM,"Charter Communications, Inc. Earnings Missed Analyst Estimates: Here's What Analysts Are Forecasting Now Simply Wall St."
86,May-04-20 01:22PM,"David Carlson's Elfun Trusts Cuts Visa, Apple, Microsoft GuruFocus.com"
87,May-02-20 11:51AM,Coronavirus update: More than a million people have recovered; Trump pushes China conspiracy theory MarketWatch
88,09:05AM,Why Charter Communications could be in same exclusive club as Amazon and Netflix MarketWatch
89,May-01-20 07:14PM,US Indexes Lower Friday on New Tariff Warnings GuruFocus.com
90,01:31PM,Charter Communications Inc (CHTR) Q1 2020 Earnings Call Transcript Motley Fool
91,12:44PM,Charter (CHTR) Q1 Earnings & Revenues Up Y/Y on User Growth Zacks
92,07:25AM,Charter Communications Q1 results come up short of expectations MarketWatch
93,07:00AM,Charter Announces First Quarter 2020 Results PR Newswire
94,Apr-30-20 12:36PM,"Media Stock Q1 Earnings: Key Predictions for CHTR, DISH Zacks"
95,09:22AM,Why Charter Communications (CHTR) Might Surprise This Earnings Season Zacks
96,Apr-29-20 04:36PM,"AT&T, Charter, Others Face Call to Cut Fees in the Absence of Live Sports Motley Fool"
97,Apr-27-20 04:21PM,Charter Outperforms Comcast Stock Heading Into Cable TV Earnings Investor's Business Daily
98,07:43AM,"When Google CEO Sundar Pichai took over Alphabet, his compensation jumped to more than a quarter-billion dollars MarketWatch"
99,Apr-26-20 03:00PM,"Tesla, Amazon, Boeing and Other Stocks for Investors to Watch This Week Barrons.com"
