,0,1
0,Aug-25-20 12:45PM,Is Adobe (ADBE) a Smart Long-term Buy? Insider Monkey
1,09:46AM,Better Buy: Adobe vs. CrowdStrike Motley Fool
2,09:31AM,Global Markets Review: S&P 500 at Record Highs as Euro Wobbles Investopedia
3,Aug-24-20 05:45PM,Adobe Systems (ADBE) Gains But Lags Market: What You Should Know Zacks
4,12:06PM,"Dow Jones Surges 300 Points On Trump's 'Very Good News', AstraZeneca's Coronavirus Vaccine; Apple, Tesla Reverse From Record Highs Investor's Business Daily"
5,11:23AM,Do Institutions Own Adobe Inc. (NASDAQ:ADBE) Shares? Simply Wall St.
6,09:59AM,Adobe (ADBE) Breaks Out to All-Time High Investopedia
7,08:17AM,Dow Jones Futures Rise On Apple Despite Long-Term Stock Market Rally Warning Investor's Business Daily
8,Aug-21-20 04:56PM,20 Best Blue-Chip Stocks for 2020 and Beyond InvestorPlace
9,08:18AM,"Dow Jones Futures Fall: Four Reasons To Be Bullish About The Stock Market Rally; Apple, Tesla Hit Historic Levels Investor's Business Daily"
10,07:31AM,3 More Stocks That Could Be Worth $1 Trillion In a Decade Motley Fool
11,07:29AM,"Strange Moves, Jobless Masses, Vaccine Hope, Adobe Advances: Market Recon TheStreet.com"
12,Aug-19-20 08:14AM,"Dow Jones Futures: Amazon, Google Flash Buy Signals In Stock Market Rally; Target, Lowe's Crush Views Investor's Business Daily"
13,06:19AM,"4 Stocks That Turned $1,000 into $10,000 Motley Fool"
14,Aug-18-20 10:10AM,"Dow Jones Falls 100 Points Amid Earnings From Home Depot, Walmart; S&P 500 Hits Record High, While Amazon, Tesla Jump Investor's Business Daily"
15,Aug-17-20 09:53PM,SoftBank Bets $3.9 Billion on U.S. Giants From Amazon to Tesla Bloomberg
16,05:45PM,Adobe Systems (ADBE) Outpaces Stock Market Gains: What You Should Know Zacks
17,11:54AM,This Stock Doesnt Need More Stimulus to Win Motley Fool
18,08:01AM,Adobe vs DocuSign: Which Cloud Stock Looks Better Right Now? SmarterAnalyst
19,07:56AM,"Dow Jones Futures: Stock Market Rally Sends Message; JD Earnings Top, Tesla Gets Price Target Hike Investor's Business Daily"
20,07:00AM,Startups Tap a New Talent Pool: Pandemic-Weary College Students Bloomberg
21,Aug-14-20 03:36PM,"Forget Wayfair, Buy DocuSign Instead InvestorPlace"
22,07:12AM,Is Adobe Stock a Buy? Motley Fool
23,Aug-13-20 01:19PM,Apples Subscription Bundles Dont Move the Needle Enough Bloomberg
24,12:24PM,"Dow Jones Falls 100 Points Amid Surprise Jobless Data; Cisco Dives 12% On Earnings; Apple Hits All-Time High, While Tesla Jumps 6% Investor's Business Daily"
25,11:01AM,Apple remembers the time it almost went bankrupt as it eyes future outlook: Analyst Yahoo Finance Video
26,08:12AM,"Dow Jones Futures Signal Stock Market Rally Pause; Tesla Stock, Three Giants In Buy Zones; Apple Ready To Bundle? Investor's Business Daily"
27,Aug-11-20 05:45PM,Adobe Systems (ADBE) Dips More Than Broader Markets: What You Should Know Zacks
28,Aug-10-20 10:47AM,"The Zacks Analyst Blog Highlights: Adobe, Abbott Laboratories, Barrick Gold, HSBC Holdings and Square Zacks"
29,Aug-08-20 01:37PM,"Microsoft, Amazon Lead Five Stocks To Watch In Or Near Buy Zones Investor's Business Daily"
30,Aug-07-20 03:11PM,"Nasdaq Slumps 1.2%, Hurt By Software Sell-Off; Solar Stocks Are Flying Here's Why Investor's Business Daily"
31,02:25PM,"Top Analyst Reports for Adobe, Abbott & Barrick Gold Zacks"
32,12:33PM,10 Biggest Software Companies Investopedia
33,08:17AM,"Dow Jones Futures Fall: Apple, Facebook Soar, But These Clouds Loom Over Stock Market Rally Investor's Business Daily"
34,Aug-06-20 01:00PM,Investor Advisory: Adobe Announces Webcast of Investor Conference Participation Business Wire
35,10:59AM,Adobe Finds Support Investor's Business Daily Video
36,Aug-04-20 03:35PM,Here's Why I Think Adobe (NASDAQ:ADBE) Is An Interesting Stock Simply Wall St.
37,Aug-03-20 05:45PM,Adobe Systems (ADBE) Outpaces Stock Market Gains: What You Should Know Zacks
38,04:12PM,"It's Personal: AI Tech Giant Partners With IBM, Builds New Buy Zone Investor's Business Daily"
39,08:00AM,Adobe's plans for an online content attribution standard could have big implications for misinformation TechCrunch
40,Jul-30-20 08:00AM,Why Twilio Stock Is Cheaper Than It Looks Motley Fool
41,Jul-29-20 10:00AM,Better Buy: Adobe vs. Microsoft Motley Fool
42,Jul-28-20 05:45PM,Adobe Systems (ADBE) Dips More Than Broader Markets: What You Should Know Zacks
43,Jul-27-20 05:02PM,Colleges Tap Tech to Calm Students Paying for Remote Classes Bloomberg
44,01:07PM,Morgan Stanley Turns Cautious on Software. But Here Are 12 Stocks You Can Still Buy. Barrons.com
45,06:00AM,Only 4% of Companies Reveal the Racial Makeup of Their Employee Base. Investors Are Pushing to Change That. Barrons.com
46,Jul-25-20 07:00AM,"Got $3,000 to Invest? Here Are 3 No-Brainer Stocks to Buy in Cloud Computing Motley Fool"
47,Jul-24-20 09:37PM,3 Great Healthcare Stocks to Watch Motley Fool
48,01:51PM,Invest in Unomi for Next-Generation Video Game Development InvestorPlace
49,Jul-22-20 05:45PM,Adobe Systems (ADBE) Gains But Lags Market: What You Should Know Zacks
50,01:03AM,Adobe Is Building A Camera App With Former Google-Pioneer SmarterAnalyst
51,Jul-21-20 03:07PM,"Adobe, IBM Partner On Hybrid Cloud For Banking, Healthcare Industries SmarterAnalyst"
52,03:02PM,"3 Safe Haven, Stay-At-Home Tech Stocks to Buy with Nasdaq at Highs Zacks"
53,08:18AM,"Dow Jones Futures: Coronavirus Stock Market Rally Already Extended As Tesla, Amazon Lead Big Tech Winners Investor's Business Daily"
54,08:00AM,"Adobe, IBM team up on marketing software for banking industry Reuters"
55,08:00AM,"Adobe, IBM and Red Hat Announce Strategic Partnership to Advance Customer Experience Transformation PR Newswire"
56,07:30AM,Software Growth Stocks To Buy: Earnings Reports To Test High Valuations Investor's Business Daily
57,Jul-20-20 07:38PM,3 Growth Tech Stocks to Buy Right Now Not Named Zoom or Tesla Zacks +5.28%
58,04:12PM,IBD 50 Stocks To Watch: Adobe Sets Up New Chance To Buy After 43% Run Since Jan. 1 Investor's Business Daily
59,03:38PM,Why Shares of Adobe Were Rising Today Motley Fool
60,08:58AM,"The Zacks Analyst Blog Highlights: Adobe, Coca-Cola, Honeywell International, Starbucks and Fiserv Zacks"
61,Jul-18-20 07:08AM,"Got $5,000? These Are 3 Stocks You Can Buy and Hold Forever Motley Fool"
62,Jul-17-20 01:33PM,"Top Research Reports for Adobe, Coca-Cola & Honeywell Zacks"
63,Jul-16-20 02:41PM,"Is Adobe Stock A Buy Right Now? Here's What Earnings, ADBE Chart Show Investor's Business Daily"
64,09:47AM,"Online Spending Continues at Record Pace, and Includes Price Inflation WWD"
65,Jul-15-20 12:40PM,Shopify Rival BigCommerce Files for IPO to Get In On the Rally Motley Fool
66,Jul-14-20 11:11AM,"The Zacks Analyst Blog Highlights: Splunk, Microsoft, Invesco QQQ Trust, Adobe and Alibaba Zacks"
67,10:00AM,Artificial Intelligence Stocks To Buy And Watch Amid Rising AI Competition Investor's Business Daily
68,Jul-13-20 02:54PM,My Top Stock Picks Review Zacks -5.09%
69,02:32PM,Online food prices jump as food companies struggle to meet demand MarketWatch
70,09:07AM,Online spending since March 1 was $77 billion higher than expected: Adobe MarketWatch
71,08:58AM,Stocks To Buy: Is It Time To Buy Or Sell These Large-Cap Stocks? Investor's Business Daily
72,08:28AM,Adobe (NASDAQ:ADBE) Could Easily Take On More Debt Simply Wall St.
73,Jul-11-20 11:30AM,Adobe (ADBE) Up 20.3% Since Last Earnings Report: Can It Continue? Zacks
74,Jul-09-20 07:22PM,"Walgreens: Recovering With the People, Not the Economy GuruFocus.com"
75,07:49AM,Walgreens stock falls after reporting $2 billion impairment due to COVID-19 MarketWatch
76,Jul-08-20 09:02AM,"The Zacks Analyst Blog Highlights: Microsoft, Nvidia, Tesla and Adobe Zacks"
77,Jul-07-20 04:34PM,"Buy Low, Sell High Zacks"
78,01:11PM,Adobe tests an AI recommendation tool for headlines and images TechCrunch
79,Jul-05-20 06:55PM,At Least 1 of the 10 Best-Performing Tech Stocks This Year Has Gone Too Far Barrons.com
80,10:06AM,Why Adobe Stock Climbed 12.6% in June Motley Fool
81,Jul-02-20 05:44PM,Were Hedge Funds Right About Piling Into Adobe Inc. (ADBE)? Insider Monkey
82,09:05AM,Better Buy: Adobe vs. Shopify Motley Fool
83,Jul-01-20 12:39PM,Heres Why Adobe (ADBE) Stock Could be a Solid Buy in Todays Market Insider Monkey
84,Jun-30-20 04:36PM,Find Strong Stocks with this New Analyst Coverage Screener Zacks
85,09:55AM,Major indices open flat as coronavirus cases climb Yahoo Finance Video
86,08:42AM,Is the Options Market Predicting a Spike in Adobe (ADBE) Stock? Zacks
87,Jun-29-20 04:28PM,5 Tech Stocks to Buy for Second Half of 2020 That Aren't FAANG or Microsoft Zacks
88,Jun-28-20 11:32AM,"The 100 Most Sustainable Companies, Reranked by Social Factors Barrons.com"
89,Jun-26-20 02:03PM,3 Cheap Stocks Under $20 to Buy Despite Spikes in Coronavirus Cases Zacks
90,12:29PM,"Quidel, Keysight Technologies, Adobe, Nvidia and Zoom Video as Zacks Bull and Bear of the Day Zacks"
91,08:00AM,Await Pullback Before Buying Too Hot to Touch DocuSign Stock InvestorPlace
92,Jun-25-20 06:00PM,Is Cheap Tech Stock Yext a Strong Buy for the Digital Economy? Zacks
93,02:32PM,"3 Large-Cap Tech Stocks to Buy Now Not Named Apple, Amazon or Microsoft Zacks"
94,10:51AM,"Yes, You Can Time the Market. Find out How - June 25, 2020 Zacks"
95,08:48AM,Edtech Gains Prominence Amid Coronavirus: Tech Giants to Watch Zacks
96,Jun-24-20 09:41AM,Edited Transcript of ADBE earnings conference call or presentation 11-Jun-20 9:00pm GMT Thomson Reuters StreetEvents
97,Jun-23-20 06:14PM,Goldilocks and the Moat Concept GuruFocus.com
98,12:09PM,"The Zacks Analyst Blog Highlights: Facebook, Adobe, Amgen, Lowe's and TJX Zacks"
99,Jun-22-20 05:17PM,"Top Stock Reports for Facebook, Adobe & Amgen Zacks"
