,0,1
0,Aug-25-20 12:00PM,Berkshire Hathaway Inc. (BRK.B) Upgraded to Buy: What Does It Mean for the Stock? Zacks
1,11:19AM,Does 'Don't Lose Money' Hurt Berkshire Shareholders? GuruFocus.com
2,09:57AM,How to Find a Company's Value Motley Fool
3,09:51AM,Kroger (KR) Could Test 2015's All-Time High Investopedia
4,07:21AM,Warren Buffett's 4 Most Surprising Q2 Moves Motley Fool
5,Aug-24-20 07:14PM,"Francis Chou Slims 4 Holdings, Axes Sanofi in 2nd Quarter GuruFocus.com"
6,01:05PM,Top Financial Stocks for September 2020 Investopedia
7,10:38AM,Warren Buffetts Berkshire Isnt Getting the Love for Its Apple Stake Bloomberg
8,06:06AM,92% of Buffett's Portfolio Is in These 3 Sectors Motley Fool
9,Aug-23-20 10:19PM,Market timing when clocks have no hands Warren Buffetts warning is as relevant now as it was in 2000 MarketWatch
10,06:47AM,"Where to Invest $5,000 Right Now? Motley Fool"
11,Aug-22-20 10:00AM,3 Top Stocks With High Dividend Yields Motley Fool
12,Aug-21-20 07:27PM,"Tech, Tesla, and Apple Star as Stocks Keep Rising Barrons.com"
13,06:34PM,Top 10 S&P 500 Stocks by Index Weight Investopedia
14,06:22PM,Glenn Greenberg's Top 2nd-Quarter Trades GuruFocus.com
15,01:24PM,Apple Stocks Rally Just Keeps Going as Valuation Touches $2.1 Trillion Barrons.com
16,11:09AM,5 New Stocks That Are Hedge Funds Favorites Barrons.com
17,10:26AM,Berkshire Hathaway Should Be the First Stock in Your 401k InvestorPlace
18,07:02AM,"Got $1,000? Here are 2 Stocks to Consider Motley Fool"
19,06:51AM,Is Warren Buffett Giving Up On Bank Stocks? Motley Fool
20,06:01AM,Better Buy: Berkshire Hathaway or Bank of America Motley Fool
21,Aug-20-20 11:15AM,Buffett Backs Gold in a Surprise Move GuruFocus.com
22,08:00AM,Why Warren Buffett May Already Be Feeling Better About the Banking Sector Motley Fool
23,07:21AM,Warren Buffett Just Bought a Gold Stock -- or Did He? Motley Fool
24,07:20AM,It was definitely a gamble: What you need to know before buying a home virtually MarketWatch
25,06:15AM,Does Buffett's Selling of JPMorgan Show His True Feelings About the U.S. Economy? Motley Fool
26,06:05AM,3 Popular Stocks Billionaires Heavily Sold in Q2 Motley Fool
27,Aug-19-20 04:37PM,Warren Buffett's History With Silver GuruFocus.com
28,04:28PM,Warren Buffett's Apple Eclipses $2 Trillion Market Cap GuruFocus.com
29,03:54PM,Private-Equity Firm Onex Might Have a Successor for Its Founding CEO Barrons.com
30,03:15PM,Bank of America Is Taking a Cautious Line. Its One Reason to Buy the Stock. Barrons.com
31,02:02PM,Warren Buffett's History With Oil GuruFocus.com
32,01:49PM,"Bruce Berkowitz Increases Exposure to Berkshire Hathaway, Dumps Vista Outdoor GuruFocus.com"
33,01:00PM,5 ETF Strategies to Follow Latest Investing Style of Buffett Zacks
34,12:11PM,Some Thoughts on Warren Buffett's Recent Stock Moves GuruFocus.com
35,11:01AM,"Apple's Market Cap Just Hit $2 Trillion, but Is the Stock a Buy? Motley Fool"
36,10:39AM,How Berkshire Is Hedging Against Disaster Motley Fool
37,07:07AM,These 3 Value Stocks Are Absurdly Cheap Right Now Motley Fool
38,06:26AM,3 Dividend Stocks That Pay You Better Than Coca-Cola Does Motley Fool
39,06:08AM,The Q2 Moves Warren Buffett Is Most Likely to Regret Motley Fool
40,06:06AM,Warren Buffett's 3 Biggest Buys in 2020 Motley Fool
41,Aug-18-20 06:27PM,"We're Back: S&P 500 Reaches All-Time High, Walmart, Home Depot Earnings, Oracle TikTok Play, Buffett Selling Stocks in 2020 Motley Fool"
42,04:58PM,Here's What Warren Buffett Is Buying and Selling Motley Fool
43,03:04PM,Why Doing Homework Is Important Motley Fool
44,01:55PM,"Stanley Druckenmiller Curbs Big Tech, Buys Cyclical Companies in 2nd Quarter GuruFocus.com"
45,12:36PM,Looking at the Most Popular Hedge Fund Stocks of the 2nd Quarter GuruFocus.com
46,11:40AM,"Is Buffett Selling Banks, Buying Gold A Warning Sign For Investors? Benzinga"
47,10:50AM,"Bill Gates, Elon Musk, Jeff Bezos and the rest of the Oligarchic Dozen just reached a disturbing milestone MarketWatch"
48,10:36AM,Why AMC Entertainment Stock Is Up Motley Fool
49,09:07AM,JPMorgan Chase (JPM) Trading Lower After Buffett Sale Investopedia
50,08:00AM,Is Coca-Cola Stock a Buy? Motley Fool
51,07:31AM,Warren Buffett Just Bought These Stocks Motley Fool
52,06:46AM,Warren Buffett's Shocking New Investment Motley Fool
53,06:13AM,3 Moves Warren Buffett Made in the Coronavirus Recovery Motley Fool
54,06:06AM,Yikes! Buffett Has Now Sold 32 Stocks in 6 Months Motley Fool
55,06:00AM,2 Warren Buffett Stocks Worth Buying Now Motley Fool
56,05:00AM,"A 24% Probability of Default for Wayfair, and Two More Numbers to Know Barrons.com"
57,Aug-17-20 08:02PM,GLOBAL MARKETS-Asia shares set to follow Wall Street's tech-driven rally Reuters
58,06:29PM,"S&P 500 News: Buffett Sells Oil Stocks, Buys Gold Miner; GM Shares Surge on EV Spinoff Idea Motley Fool"
59,06:14PM,Warren Buffett Dives Into Gold GuruFocus.com
60,04:38PM,Gold Miners Jump With Berkshire Sending Barrick to 2013 High Bloomberg
61,04:30PM,"Stock Market Today: Nasdaq Rolls, S&P Still Can't Catch the Bull Kiplinger"
62,03:55PM,"Bill Ackman Bows Out of Berkshire, Blackstone and Park Hotels & Resorts GuruFocus.com"
63,03:50PM,Why Barrick Gold Stock Surged Today Motley Fool
64,03:49PM,The S&P 500 Is Oh-So Close to a Record High. It Might Not Get There. Barrons.com
65,03:14PM,"Hedge Funds Starting To Tire Of Tech, Dumping Bank Stocks Benzinga"
66,03:09PM,Low Rates Might Not Be as Bad for Bank Stocks as You Think. Heres Why. Barrons.com
67,02:33PM,Heres Why Berkshire Hathaway Stock is an Attractive Pick for Investors Insider Monkey
68,01:31PM,Marital home of actors Martin Landau and Barbara Bain lists in Westwood LA Times
69,01:25PM,Warren Buffett Probably Didnt Buy Barrick Gold. Its Stock Is Surging Anyway. Barrons.com
70,01:13PM,Berkshire Hathaway: Thoughts on the Conglomerate's Gold Buy GuruFocus.com
71,12:43PM,Barrick Gold (GOLD) Gains After Berkshire Discloses Stake Investopedia
72,11:40AM,Gold Stocks Lead a New Stock Market Surge Motley Fool
73,11:18AM,Buffett's Berkshire Hathaway Reveals Some Surprise Moves Motley Fool
74,10:42AM,This Hedge Fund Thinks Popeyes Is a Better Bet Than Berkshire Hathaway Motley Fool
75,10:39AM,"CANADA STOCKS-TSX gains on China stimulus, materials boost Reuters"
76,10:31AM,"Berkshire's Barrick Stake Pushes Up Miners Newmont, Kinross TheStreet.com"
77,10:13AM,Opt for These Stocks as Buffett Buys Stakes in Gold Mining Zacks
78,10:04AM,3 Reasons Buffett's Barrick Gold Buy Isn't Such a Crazy Move Motley Fool
79,08:29AM,Warren Buffetts Berkshire Hathaway Bought Barrick Gold and Dumped Occidental Petroleum Barrons.com
80,08:25AM,"Tesla Stock Gains, Banks Drop as the Dow Inches Higher Barrons.com"
81,08:22AM,"Barrick Gold Increases Its Dividend, Plus 3 Other Companies Barrons.com"
82,06:16AM,4 Investing Lessons to Learn From Warren Buffett Motley Fool
83,Aug-16-20 05:05PM,These 4 Companies Will Be the Biggest Winners if Manufacturing Moves Back to the U.S. Motley Fool
84,02:27PM,Did Warren Buffett just bet against the U.S. economy? His latest investment raises some questions MarketWatch
85,08:50AM,What to Expect in the Markets This Week Investopedia
86,08:35AM,"Berkshire Cuts Bank Holdings, Takes Position in Gold Investopedia"
87,Aug-15-20 06:05AM,4 Things Berkshire Hathaway's Earnings Told Us About COVID-19 Motley Fool
88,Aug-14-20 07:52PM,Warren Buffett's Berkshire Hathaway Sells Off Its Restaurant Brands Stake Motley Fool
89,07:21PM,"Apple, Tesla Stock Splits Could Encourage Others Barrons.com"
90,06:55PM,"Buffett Takes Barrick Gold Stake, Dumps Goldman Sachs, Occidental Petroleum TheStreet.com"
91,06:36PM,"Berkshire Switches Bets on Banks, Adds Wager on Barrick Gold Bloomberg"
92,06:32PM,"ESG Investors Can Beat the Market Without Apple, Amazon. Heres How. Barrons.com"
93,06:30PM,Warren Buffett Dumped a Big Chunk of Wells Fargo Stock. This Hedge-Fund Manager Was Buying It. Barrons.com
94,06:24PM,Buffett Didn't Buy Banks in Q2 Motley Fool
95,06:10PM,Prem Watsa's Top 4 Trades in the 2nd Quarter GuruFocus.com
96,05:38PM,Berkshire Makes a Bet on Gold Market That Buffett Once Mocked Bloomberg
97,04:35PM,Stock Market Today: The Rally Shows Signs of Vulnerability Kiplinger
98,04:28PM,"Berkshire slashes Wells Fargo, JPMorgan stakes; adds Barrick Gold Reuters"
99,12:55PM,Warren Buffett: The Ruthless Business Manager GuruFocus.com
